,product_id,product_parent,product_title,vine,verified_purchase,review_headline,review_body,review_date,marketplace_id,product_category_id,label
2838,B003A2JBW8,672448323,LEGO - 8043 - Jeu de construction - LEGO® Technic - La pelleteuse motorisée,N,Y,8043,Très bon produit lego... d'un réalisme et d'une technique superbe même si cela reste un jouet lego nous surprendra toujours grand ou petit.,2013-06-28,2,2,False
2845,B00MV0FT4Y,558420564,1989 (Deluxe Edition),N,Y,sehr schönes Album,"Anders als ihr letzten Alben! Ist allerdings Geschmacksache, ich für meinen Teil kann aber sagen, dass ich das Album sehr sehr gelungen und schön finde!",2014-12-03,0,16,False
2847,8866135909,800883302,perfekt,N,Y,Moleskine Wochen-Notizkalender 18 Monate 2013-2014 / Large / Weicher Einband / Schwarz (Planners & Datebooks),"wie bei moleskine  zu erwarten: perfekt um slles notwendige einzutragen, werde für nächstes jahr wieder ein moleskine kaufeund es jeder zeit weiterempfehlen",2013-05-30,0,0,True
2888,B00835VZDU,687235124,Moonrise Kingdom [Blu-ray],N,N,,"On l'aura compris, cette note ne porte que sur l'édition Blu-ray scandaleuse commise par StudioCanal et non sur ce petit bijou qu'est ce film. En apparence, c'est le portage de l'édition US. Le contenu est identique et seules les langues proposées diffèrent. Mais, par souci d'économie (traduire appât du gain), StudioCanal a fait tenir le tout sur un Blu-ray simple couche contrairement à l'édition US qui est double couche. Et pour y parvenir, ils n'ont pas diminué la taille des suppléments ni rogné sur la qualité sonore, ils ont tout simplement compressé la piste vidéo à la moitié de sa taille initiale ! Sur la version US, la piste vidéo du film (sans les pistes son) pèse 21,1 Go. Sur l'édition StudioCanal, elle ne fait plus que 11,1 Go !! Un super DVD en quelque sorte. On imagine aisément les dégâts à l'image.<br />Donc n'achetez surtout pas cette version au rabais de StudioCanal et commandez l'édition US, qui a également une piste son en VFF pour les amateurs, et peut être lue sur une platine européenne (Blu-ray &#34;Region-free&#34;).",2013-07-12,2,3,True
2889,B00IG2DOKM,784083581,Township,N,Y,Five Stars,Brli,2015-02-16,1,13,False
2901,B00DE6NH7U,260363984,,N,Y,Quartet,"Un film anglais dirigé par l'excellent Dustin Hoffman(américain)musique classique, OPERA..pour un amateur de bons films, de films anglais et d'Opéra que demander de plus, j'ai adoré ce film qui doit se voir et se revoir, les comédiens de qualité, émotion, sensibilité,amitié, ambiance anglaise,charme, paysages fabuleux, c'est la force des anglais, ce n'est pas difficile avec cette belle campagne, les petites intrigues dans cette maison de repos, donc c'est décidé dans cette maison de repos, je veux bien y aller, un jour...je m'y précipite...",2013-09-08,0,1,True
2911,B007NU530W,682981764,Downton Abbey - Staffel 2 [4 DVDs],N,Y,Spannende Geschichte,Empfohlen vom Englischlehrer und für gut befunden. Sehr spannend erzählte Familiengeschichte der Familie von Downtown Abbey mit Darstellung auch der einfachen Leute und ihrer Träume im England der ersten Hälfte des 20. Jahrhunderts.,2014-04-25,0,3,True
2913,B00E3QHNNE,549078163,Die Schlümpfe 2,N,Y,alles super,wir scháúén dié Schlümpfé2 tớtál gérné únd bin frớh dás éndlich áúf DVD zú Háúsé zú hábén scháff´ s nämlich séltén im TV,2014-09-19,0,3,False
2921,B009KLH0D0,446906754,Celebration Day (2CD + 2DVD),N,Y,Chance vertan!,"Ich wár vớrgéwárnt vớn dén érstén Rézésiớnén, dié Klángqúálität wúrdén vớn éinigén Áútớrén áls dớch éhér schlécht béwértét. Álsớ hábé ich bis Mái 2013 géwártét únd érst dánn, áls dér Préis fást 50 % rúntér wár, mir dás Wérk méinér Hérớés áús dén 70ér béi Ámázớn gékáúft. Únd tátsächlich, hiér wúrdé éiné grớßé Cháncé vértán.<br />Dié Músik spricht émớtiớnál án, mán mérkt, dáss dié Hérrén Plánt, Págé únd Jớnés mit Bớnhám Júniớr sich inténsiv áúf diésés Kớnzért vớrbéréitét hábén. Dér Fúnké springt übér, kéiné Frágé, Léd Zéppélin kánn és nớch immér! Wás án diésém Ábénd in Lớndớn músikálisch ábgéliéfért wúrdé ist érstklássig. Dáfür múss mán fünf Stérné vérgébén. Für dén Kláng gibt és állérdings wirklich núr éinén Stérn. Hiér wúrdé éiné grớßé Cháncé vérgégébén, diésén éinmáligén Ábénd áúch klánglich éinzúfángén. Dié Wiédérgábé ist wénig différénziért, dér Báss dröhnt, dér Kláng ist éin éinzigér Bréi. Dié téchnischén Möglichkéitén dés 21. Jáhrhúndérts wúrdén nicht ánnähérnd génútzt. Wénn dié Mástértápés ớk sind, ist viélléicht éin Rémástér já spätér nớch éinmál drin ;-). Mit Bớớklét únd Vidéớ DVD kánn mán dánn ábér 3 Stérné vérgébén..<br /><br />P.S. Ich kánn diéjénigén Kớllégén léidér nicht vérstéhén, dié dié Klángqúálität diésér CD in dén Himmél hébén únd sich áúch nớch béi dénjénigén béschwérén, dié vérsúchén gégén dén Máinstréám hiér éiné éntspréchéndé Klángbéwértúng vớrzúnéhmén. És wird dádúrch léidér nicht béssér!",2013-05-11,0,6,True
2935,B0057YFX9C,240481447,Jason Bourne - Coffret trilogie : La mémoire dans la peau + La mort dans la peau + La vengeance dans la peau [Pack Collector boîtier SteelBook],N,Y,Mythique,"Une superbe trilogie, à posséder.<br /><br />Je n'ai pas encore regarder les bonus mais les 3 films sont d'une excellente qualité. De l'action \\""réaliste\\"" et pas bourré d'effets spéciaux, de bonnes cascades, des poursuites sympathiques. A posséder.",2012-09-20,2,3,False
2945,B006LNA78K,540640723,Insidious,N,Y,,Je trouve que c'est un film vraiment excellent beaucoup de paranormal et il nous tient tout le film ont ne s'ennuie pas ! Le 2 est vraiment pas géniale par contre !,2014-11-07,2,3,False
2953,B00004XQSR,22701133,Pride and Prejudice [Region 2],N,N,Wonderful production. Poor DVD,"My enjoyment of this superb BBC adaptation was marred somewhat by the poor quality of the DVD. The scenes and episodes are not organized in a useful or user-friendly way, but worst of all, the colour is badly bleached and washed out. None of those lovely Derbyshire scenes appeared with any of the vibrancy they had when broadcast on TV. I'm afraid something went wrong in the transfer onto DVD. This is something I'd expect the BBC to get right. Especially for a top-end price DVD of a major TV series.",2001-03-21,1,3,True
2957,B00FAX6XQC,442467296,DEER HUNTER CLASSIC,N,Y,AWESOME GAME,I have got many guns on it. easy to gain cash. just can't resist playing it.  :-)  :-),2014-11-03,0,1,False
2961,B00EZJQV0A,169041373,Hớmélánd 2,N,Y,Homeland - Die komplette Season 2 [4 DVDs],"Wo es im Fernsehen kam hatte ich keine Zeit. Da ich großer 24 Fan bin, dachte ich dies kannst Du dir mal antun und ich bin begeistert. Es ist zwar völlig anders wie 24, aber genau so spannend. Warte schon auf die 3. Staffel.",2014-01-22,0,3,False
2976,B0060SVG54,302116447,Zwei an einem Tag,N,Y,Bewegender Film,"Sehr schöner Film. Allerdings würde ich empfehlen vorher das Buch zu lesen, ansonsten kann es passieren, dass dieser Film &#34;zu schnell&#34; ist.",2013-05-07,0,11,False
2995,B0001Z6440,268271596,,N,Y,WARNER HOME VIDEO Gettysburg [DVD],"Attention, il n'y a pas de piste audio française ni de sous-titres en français... (islandais oui, mais pas français...) C'est bon à savoir.",2012-07-16,2,3,True
3006,0804106304,31287929,Joy Luck Club (Roman),N,N,Boring.,This bớớk is ás stéryớtypéd ás théy cớmé,2000-02-07,0,0,False
3013,B0000667LK,764577594,Iron Maiden: Rock In Rio [DVD] [2002],N,Y,Five Stars,excellent very pleased,2015-01-17,1,3,False
3019,B000HDZC1W,906411515,Scháúrig schön,N,N,Silent Hill: Willkommen in der Hölle,"Schön wie ein Bild von Hieronymus Bosch! <br /> <br />Die Story ist langsam, die Dialoge sind schlecht - aber dennoch ist der Film mehr als sehenswert. Die Kulissen und Figuren (bzw. Kreaturen) sind sehr beeindruckend. <br /> <br />",2006-12-12,0,3,True
3033,B00000I26R,867009196,The Crimson Idol,N,N,Who is Blackie ?,"En 1992 WASP n'est alors plus qu'un nom . D&eacute;sormais seul maître &agrave; bord d'un groupe qui n'en n'est plus un, Blackie Lawless a tout le loisir d'y exprimer l'un de ses vieux rêve \\""m&eacute;galo-maniac\\"": Cr&eacute;er un Concept album. Si la d&eacute;marche est tout &agrave; fait louable, reconnaissons que pour ce qui est de l'originalit&eacute; ... Il faudra repasser; Le Concept ne l'&eacute;tant gu&egrave;re d'avantage (encore une histoire de rock Star en proie &agrave; tous les  d&eacute;mons). Il y a des m&eacute;chants (le music business surtout), le p&egrave;re absent, la m&egrave;re, la diseuse de bonne aventure. Manque &agrave; l'appel le fr&egrave;re, la sœur oh ! oooh ! ça aurait &eacute;t&eacute; le bonheur.<br /><br />Bon je sais, on va me dire que je fais mon malin et que fracasser aussi facilement cette oeuvre, si personnelle et si ch&egrave;re &agrave; Blackie, n'est pas tr&egrave;s fair-play de ma part. J'en conviens !<br />Seulement voil&agrave; ! Je savais, comme la plus part d'entre vous, que Blackie &eacute;tait un fan inv&eacute;t&eacute;r&eacute; du groupe de Pete Townshend (sur le g&eacute;nial \\""Headless Children\\"" le groupe y reprenait d&eacute;j&agrave;, et avec panache, \\""The Real Me\\""), fallait-il pour autant que \\""The Crimson Idol\\"" soit &agrave; ce point emprunt de l'h&eacute;ritage des Who ? Singeant en premier lieu le jeu ultra fournit (descentes de toms en rafale) de leur batteur Keith Moon.<br /><br />Loin d'être mauvais, \\""Crimson Idol\\"" est &eacute;galement construit sur la d&eacute;clinaison d'un th&egrave;me instrumental qui, sur la dur&eacute;e de l'album donne cet effet de \\""recyclage\\"" et/ou de r&eacute;p&eacute;tition lassante.<br />Blackie ayant d&eacute;cid&eacute; de tout faire par lui même, l'album souffre &eacute;galement d'une production tr&egrave;s s&egrave;che et sans r&eacute;el relief. Il en r&eacute;sulte une Basse quasi inexistante et un son batterie qui, pour un tel disque, aurait du être diff&eacute;rent de ce qu'il est, c'est &agrave; dire \\""acceptable\\"".<br /><br />Heureusement, Blackie sait encore &eacute;crire de tr&egrave;s bonnes chansons, même si &agrave; cet exercice il emprunte d&eacute;sormais trop souvent &agrave; d'autres: Les Who (vous aviez compris), mais &eacute;galement Iron Maiden, au d&eacute;tour du saignant \\""Chainsaw Charlie\\"". Vous me direz, cette influence &eacute;tait d&eacute;j&agrave; pr&eacute;sente sur [[ASIN:B00009W18E The Headless Children]].<br /><br />\\""Crimson Idol\\"" est donc le dernier album de WASP que j'aurais poss&eacute;der, avant d'y replonger, quelques 15 ans plus tard, grâce &agrave; un [[ASIN:B00IDN0K4M Dominator by WASP (2007) Audio CD]] beaucoup mieux maîtris&eacute;, moins pr&eacute;tentieux sans doute et fleurant bon le vrai WASP... En tout cas dans l'id&eacute;e que je m'en faisais au meilleur de sa cr&eacute;ativit&eacute;, quand WASP &eacute;tait un groupe.<br /><br />13/20u'il est, c'est &agrave; dire \\""acceptable\\"".<br /><br />Heureusement, Blackie sait encore &eacute;crire de tr&egrave;s bonnes chansons, même si &agrave; cet exercice il emprunte d&eacute;sormais trop souvent &agrave; d'autres: Les Who (vous aviez compris), mais &eacute;galement Iron Maiden, au d&eacute;tour du saignant \\""Chainsaw Charlie\\"". Vous me direz, cette influence &eacute;tait d&eacute;j&agrave; pr&eacute;sente sur [[ASIN:B00009W18E The Headless Children]].<br /><br />\\""Crimson Idol\\"" est donc le dernier album de WASP que j'aurais poss&eacute;der, avant d'y replonger, quelques 15 ans plus tard, grâce &agrave; un [[ASIN:B00IDN0K4M Dominator by WASP (2007) Audio CD]] beaucoup mieux maîtris&eacute;, moins pr&eacute;tentieux sans doute et fleurant bon le vrai WASP... En tout cas dans l'id&eacute;e que je m'en faisais au meilleur de sa cr&eacute;ativit&eacute;, quand WASP &eacute;tait un groupe.<br /><br />13/20",2009-07-27,2,6,True
3034,B004U8URGU,730316962,Chaos And Creation In The Backyard,N,Y,CD Paul Mc CARTNEY Chaos and cretion in the blackyard,"PMC est mon idole et tout ce qu'il a fait, fait ou fera me plaît;<br />Et je refais simplement ses compli en CD",2013-08-02,0,6,False
3038,B007N5YIUS,820905564,Angry Birds Space Free,N,Y,what I like about this game,most of the games my 4year old great-grandson asks me to download so that he can play them and they keep him occupied  whilst I am doing things,2014-02-13,1,1,False
3054,B0061S073A,969674310,Kids Place - Parental Control,N,Y,Top Kindersicherung für das Smartphone,"Dié Ápp biétét állé nớtwéndigén Fúnktiớnén, úm éin Smártphớné kindérsichér zú máchén. Mán kánn génáú définiérén, wás Kind dárf únd wás nicht. Ich bin vớllkớmmén zúfriédén. Wénn sớ éiné Ápp béi jédém Kind/Júgéndlichén áúf dém Hándy wäré, hättén wir éinigé Prớblémé wénigér án dén Schúlén. Únd in Kớmbinátiớn mit dér ébénfálls kớsténlớsén Ápp &#34;Kids Plácé Scréén Timé&#34; hát mán áúch dié ábéndliché Hándynútzúng im Griff. Ich bin bégéistért.",2014-07-19,0,1,False
3086,B002MRROKS,637119351,Live At Reading (Deluxe Edition CD+DVD),N,N,Essential,"Ok, here's an honest review of the DVD.    As most fans of the band will testify, you can only listen to songs so many times before they get a bit over familiar - no matter how good they are. I listened to Nirvana non-stop for years in my late teens and early twenties. My bootleg CD of this performance was the only one of many that stood the test of time due, in part, to it's impressive sound quality.    So...the first thing I'd say is that, soundwise, this official release is no better than the bootleg. Surprisingly, there's a lot of crowd noise and singing in the mix, but IMHO this simply adds to the excitement and frenzied atmosphere of the gig.    There aren't many shots of the audience, but footage of the crowd taken from behind the stage essentially positions you right next to Kurt, offering an intimate insight of what it must have been like for the band on the night. And it gave me chills to see the trio perform in such glorious high definition.     Make no mistake - this is a five-star performance. Everything that's good about Nirvana is right here on this disc: the passion, the bum notes, the banter, the chemistry, musicianship etc. And as has been pointed out, it's bittersweet to see Kurt smiling and having fun, pulling another rabbit out the hat at the top of his game. At times the renditions seem so fragile that they might fall apart altogether (Polly and All Apologies) but then that was always part of the magic of nirvana (that it never did!!). If you are a genuine fan, all I can say is don't hesitate to buy this. Sit down, pull the curtains and relax with a beer (or whatever floats your boat) and ENJOY!",2009-11-06,1,6,True
3115,B004ZN9OTG,153315946,Atom Heart Mother (remastered),N,Y,Immer ein Erlebnis,"Nachdem jahrelang Atom Heart Mother als LP in meinem Schrank seinem Dasein fristete, habe ich mich nun entschlossen, dieses Werk digital zu erstehen. Klanglich und musikalisch absolut empfehlenswert. Man muss es mit der entsprechenden Lautstärke erleben und dann geht nur noch die Post ab (auch wenn die Familienmitglieder nur noch mit dem Kopf schütteln...).",2013-01-23,0,6,True
3116,B005V5WBFG,796588140,McAfee Mobile Security,N,Y,Five Stars,c,2015-08-05,1,1,False
3120,1907698140,971035186,Those new family rules in full....,N,N,Family Procedure Rules 2010: A Guide to the New Law,"[[VIDEOID:mo3G9SQWUNR7FKW]]WITH EXPERT COMMENTARY ON THEIR PRACTICAL IMPLICATIONS<br /><br />An Appreciation by Phillip Taylor MBE and Elizabeth Taylor of Richmond Green Chambers<br /><br />If you're a family law practitioner you're no doubt keen to familiarize yourself with the new Family Procedure Rules, as they modernize and streamline many aspects of the current procedures.  Author Stephen Parker's eagerly awaited and timely new guide for the summer of 2011 from Law Society Publishing will certainly make it much easier for you to do so.<br /><br />These new rules, as Parker points out, borrow extensively from the Civil Procedure Rules in respect of a number of new powers which are well explained in the first 100 pages.<br /><br />Replacing all those rules governing the practice and procedure in family proceedings, the FPR 2010 provide for a single set of rules for the courts, and codes of procedure, whether in the High Court, county court or magistrates' court.  'Supplemented by dedicated practice directions, (PDs) and forms,''they bring together 'various procedural provisions into one single package', stresses the author, a highly qualified solicitor advocate and leading family law authority, who lectures and runs courses on the new Rules.<br /><br />Taking a practical, plain English approach, this thorough and thoroughly up-to-date guide covers all pertinent areas, including the rules of court'the key changes'and the practical implications of the rules.<br /><br />In the two appendices, (which actually comprise the bulk of the book after the first 100 pages), the text of the rules is provided in full (Appendix 1) and in the very extensive and detailed Appendix 2, you'll find all the relevant practice directions.<br /><br />For those who are in any way involved with family law matters, this book is not merely a mine of information on this subject, it is the definitive and therefore indispensible guide to this significant change to family proceedings.<br /><br />Remember, the new Family Procedure Rules 2010, SI 2010 /2955 (FPR 2010) were ultimately laid before Parliament on 17 December 2010 and came into force on 6 April 2011.  So if you have not yet acquired Stephen Parker's 'Family Procedure Rules 2010', you'll need to rush out and buy it right now.  It is your indispensible aid to best practice in family law.<br /><br />The publication date of the title is the spring of 2011 and practitioners will find the practical help invaluable as the new rules are applied- and we get used to them!2955 (FPR 2010) were ultimately laid before Parliament on 17 December 2010 and came into force on 6 April 2011.  So if you have not yet acquired Stephen Parkers Family Procedure Rules 2010, youll need to rush out and buy it right now.  It is your indispensible aid to best practice in family law.      The publication date of the title is the spring of 2011 and practitioners will find the practical help invaluable as the new rules are applied- and we get used to them!",2011-05-28,0,0,False
3131,B004MC8CA2,937221751,Bible,N,Y,great,i always carried a bible in my bag but now i have it on my kindle much lighter. Easy to navigate available in all versions a good app.,2013-12-28,1,1,True
3132,B002RI9ZQ8,588640480,The Girl with the Dragon Tattoo (Millennium series Book 1),N,Y,"Great book, really enjoyed reading it","Great book , really enjoyed reading it .",2015-02-09,1,4,False
3142,0812548094,939049888,Sword of Truth 02. Stone of Tears,N,Y,Story,Super spannende Story. Regt sogar zum nachdenken an... Nicht nur für Leute die auf Phantasy stehen geeignet. Kann ich nur weiter empfehlen,2015-07-07,0,0,False
3150,B00GZ6L48U,76307173,Kin (<-->),N,Y,Perfect,Best work I've heard for ages. Superb writing and performance. Those people that love the PMG will love this. Highly recommended.,2014-04-15,1,6,True
3167,B0043C29GE,114696345,Crazy Love [Hollywood Edition],N,Y,Four Stars,Very good DVD,2014-10-15,1,6,False
3179,B004L2LEMQ,257884456,Tron Legacy [Steelbook] [Digital Copy + Blu-ray 3D] [Limited Edition],N,Y,Béstér 3D Film,"Ớk, és ist áúch sớnst éinér méinér Liéblingsfilmé, ábér diésér úngláúblich tớllé Lớớk dés Films in 3D in pérféktér Qúálität érlébén zú könnén, dás ist schớn tớll. Wér dánn nớch éiné DTS Ánlágé hát, érlébt éin béssérés Kinớ-Érlébnis áls im Kinớ sélbst. Wér diésés pérfékté Séhérlébnis zú Háúsé éinmál génớssén hát, wird wié wir vớm Kinớ immér núr nớch énttäúscht séin - áúßér HFT 3D.",2014-02-20,0,3,False
3205,0698115635,612774409,Today Is Monday,N,Y,,Je suis fan d'eric carle en francais et en anglais alors ... je vous le recommande à lire avec des cp et des grande section sans probleme,2013-05-09,2,0,False
3216,B001ROZR4W,207716133,Vicky Cristina Barcelona [Blu-ray],N,N,Ziellos,"Woody Allen auf gewohntem Terrain, Dreiecksgeschichten sind schliesslich seine Lieblingsstorys, die er wíe kein Anderer beherscht. \\""Vicky Cristina Barcelona\\"" kommt leider nicht endgültig in Fahrt. Allens berühmter Wortwitz fällt hier sehr moderat aus auch alles was seine Filme sonst so liebenswert macht, ist hier nur in Ansätzen zu sehen.  Sehr Schade weil die sehr guten Schauspieler mit aller Freude bei der Arbeit sind.  Dennoch ist \\""Vicky Cristina Barcelony\\"" durchaus sehenswert, die perfekt arrangierte Musik träge die etwas Ziellose Story fast schon alleine.    So reicht es für immerhin fast 4 Sterne.",2009-07-19,0,3,True
3239,B005EGXTEE,245449872,The Hunger Games: 1/3 (Hunger Games Trilogy),N,N,Great read :),about a year ago I was sat in the library unsure of what to take out and because of my constant return to the library to take more books out the librarian recommended the hunger games to me. This was before the movie was announced coming out and before everyone suddenley started reading it so luckily for me i didnt have to wait a long time to get it out. as soon as i started reading it i was drawn to it and read all 3 books then waited the months until the movie came out. Afterwards I decided i loved the hunger games so much that i bought all 3 books on my kindle and read them all over again. I can't wait till the next movie comes out. I would recommend this book to everyone!!!,2012-07-11,1,4,False
3256,8131700070,141950023,Design patterns:elements of reusable object-oriented software (Livre en allemand),N,Y,pi&egrave;tre qualit&eacute;,"Le livre semble r&eacute;serv&eacute; au march&eacute; indien.<br />La qualit&eacute; d'impression est mauvaise, il y a des traces d'encre un peu partout, certaines zones sont plus pâles que d'autres, d'autres ont des bavures.<br />Il y a un bloc de pages en double.<br />Certaines pages sont pliss&eacute;es voire corn&eacute;es.<br />La quatri&egrave;me de couverture est stri&eacute;e.",2014-05-04,2,0,True
3268,B0083QKJDQ,701789007,ungewöhnlich Mischung,N,N,Cowboys & Aliens - Extended Director's Cut [Blu-ray],"ich hat große Erwartungen an den Film und bin auch nicht enttäuscht worden, eine sehr sehr gute Mischung mit viel Action",2013-04-11,3,3,False
3269,B005LN5UOC,280074210,Super Headset,N,Y,Playstation 3 - EX-03 Wireless Bluetooth Headset,"Ich besitze das Headset nun seit ca. 1 Monat und bin voll zufrieden damit. Ich kann keine schlehte Qualität oder sonstiges warnehmen. Im übrigen hat es auch eine \\""Mute Tase\\"". Mögliche Fehler oder Rauschen bei der Benutzung treten nur auf, wenn man sich von der Ps3 zu weit entfernt oder eventuell der Akku zur neige geht.",2012-11-05,0,20,True
3298,B000SNUMCK,840569198,Dark Passion Play: Special Edition,N,N,More please,"This was the first Nightwish I had heard - I read in many reviews about the last singer and how wonderful she was - personally I really like the sound of this one! I have since bought an earlier album and can't see what all the fuss was about, I could listen to Dark Passion Play over and over - in fact I do, but not the earlier stuff. I guess we all like different sounds, but for me, this album does it.",2008-07-04,1,6,True
3313,B003UOVURK,543062387,Eclipse - Bis(s) zum Abendrot (Fan Edition) [Blu-ray],N,Y,Super,"Endlich action :)der 3 Teil ist mit viel mehr Kämpfen ausgestattet, als es in den ersten beiden Teilen der Fall war.  Sehr Spannend. Nur zu empfehlen.",2011-08-23,0,3,False
3318,B00005AFVR,973612742,Live in New York City,N,Y,Five Stars,A********,2015-03-23,1,6,False
3321,B00GFHFRNM,479521754,The Book of Life: (All Souls 3) (All Souls Trilogy),N,Y,Five Stars,What a shame the  the ended!!!!! Or did it?,2014-11-29,1,4,False
3323,B00BHYD4YW,557379745,GAME OF THRONES/TRÔNE DE FER SAISON 2,N,Y,,We became hooked on Season 1 recently so had to order the 2 following séries. Just started the first Disc....Great !,2015-08-09,2,3,False
3324,B000050FII,676028219,Fight Club [Édition Collector],N,N,,"un film fort et puissant qui est à prendre à plusieurs degrés et passablement subversif dans son propos bien plus que dans son style qui est pourtant très moderne... Avec l'admirable interprétation des deux acteurs(Brad Pitt et Edouard Norton), ce film tient les trippes du début à la fin. Absurdement réduit à un film violent ,voir à une démonstration fasciste,le film s'impose tout au contraire par sa pertinence face au mal etre de notre temps,de notre generation(la generation X). Brad Pitt encore plus dejante que dans l'armee des 12 singes,...un Edward Norton traumatise apres son role dans American History X.....tout ca sur fond de Dust Brothers, et une pointe de Pixies....ce film est une Pub sur l'anarchie psychologique de notre societe....merci Mr fincher, vous avez parfaitement su transmettre l'esprit du livre de Palahniuk.....c'est beau et ca va reste longtemps dans le rayon DVD culte....",2003-04-02,2,1,True
3362,B00FNRA87U,449255100,The Take Off And Landing Of Everything,N,Y,Outstanding Elbom.,Superb. Have not stopped listening to it since it arrived. The music and lyrics are beautiful.,2014-09-10,1,6,False
