,product_id,product_parent,product_title,vine,verified_purchase,review_headline,review_body,review_date,marketplace_id,product_category_id,label
2,B0050R0XEG,888287444,Déçu,N,Y,LEGO Creator - 10220 - Jeu de Construction - Le Camping-Car - Volkswagen T1,"J'ai acheté un jeu de Lego (Lego Creator - 10220 - Construction Set - Camper - Volkswagen T1) près de deux mois, mais je n'ai toujours pas reçu l'article. Avez-vous l'envoyer à moi encore? Qui est responsable de l'article expédition?",2013-02-24,2,2,False
3,1439137692,328266944,The White Tiger: A Novel,N,N,Willkớmmén in Indién,"Ich fand das Buch sehr gut. Der Protagonist verarbeitet seine Tat, indem er uns seine Geschichte erzählt. Er versucht den Mord an seinem Herren nicht zu rechtfertigen und sieht sich auch nicht als Held. Er zeigt uns, dass tägliche Demütigung, Korruption und Kampf ums nackte Überleben dazu führen können, dass ein Mensch zum Mörder wird. War richtig spannend zum Lesen und hat zum Nachdenken gebracht. Fünf Sterne!",2011-09-05,0,0,False
10,B005GYJQE6,844211936,Green Lantern [Ultimate Edition boîtier SteelBook - Combo Blu-ray + DVD + Copie Digitale],N,Y,la lanterne.,"Pour celui qui ne connait pas le personnage, le film est plutot simple. on à le droit à une sorte de superman sauf qu'ici le héros n'as pas le pouvoir dès sa naissance. le film se regarde sans problème. petit avis négatif : on peut déplorer comme d'habitude le manque de moyen pour la bande sonore . un simple 5.1 en version française et un super DTS HD en anglais.",2012-02-11,2,3,False
53,B000O77SOK,827243381,The Practice Vol. 1,N,Y,Nepper Schlepper,"Dié Sérié ist klássé, állérdings hándélt és sich úm éiné DVD mit Ländérkénnúng ÚSÁ, dié dámit in Déútschlánd ábsớlút únbráúchbár ist. Éin Désástér.",2012-06-27,0,11,True
64,B00002663R,357442004,Thriller,N,N,MEISTERWERK DES KING OF POP,"Méistérwérk dés King ớf Pớp vớn 1983 mit ságé únd schréibé 7 Singlé-Áúskớppélúngén mit dén wéltwéitén Súpérhits \\""Billié Jéán\\"", \\""Béát it\\"", \\""Thé girl is miné, \\""Thrillér\\"" únd \\""Wánná bé stártin' sớméthin'\\"". Úm nichts schwächér áúch dié wéitérén Áúskớppélúngén \\""Húmán nátúré\\"" únd \\""Prétty yớúng thing\\"". Micháél Jácksớn wúrdé mit diésém Álbúm zúr éwigén Pớp-Légéndé. Bis héúté ist és mit 108 Milliớnén vérkáúftén Tớnträgér dás méistvérkáúfté Álbúm dér Wélt, únd máchté dén King ớf Pớp dámit únstérblich.",2011-09-30,0,6,True
66,B005F4W914,844211936,Green Lantern - Extended Cut [Blu-ray],N,N,BlúRáy vs. DVD,"Ich wollte nur mal kurz auf ein paar Rezensionen bezüglich der DVD eingehen!  Natürlich lassen sich die Hersteller Methoden einfallen um die Kunden zum Kauf einer BluRay-Disk zu bewegen!  1. Es kostet natürlich Geld zwei Formate \\""DVD und BluRay\\"" zu verkaufen als nur ein einzieges!  2. Fortschritt durch Technik! VHS -> DVD -> BluRay! Die DVD wird so oder so abgelöst werden!  3. Die BluRay-Disk bietet mehr Vorteile als eine DVD:    - sehr hohe Bild- und Tonqualität!    - mehrer Sprachen und Untertitel!    - mehr Extras!  PS: Der Film ist Super!",2011-12-06,3,3,True
75,B000BSDVRA,691955890,Victorinox - Cybertool Lite - Couteau d'Officier - Rouge Transparent,N,Y,"Un victorinox, quoi de plus ?","Un couteau victorinox comme les connait.<br />Le couteau met en confiance concernant sa qualité de fabrication.<br />Bourré de petites outils.<br />Certains peuvent sembler gadget comme la petite lampe ou l'épingle, mais s'avère très pratique.",2014-07-20,2,14,False
86,B00EVR4SCE,854345821,Wir sind die Millers [Blu-ray],N,Y,Wurde schon viel geschrieben ...,"Já, ér ist lústig. Néin, findé ich kéin typischér &#34;Fámiliénfilm&#34;. És ist áúch nicht n&ớúml;tig krámpfháft zú láchén - dér Witz ist éinfách dá. Dénké, dén Film lớhnt és sich zú Háúsé stéhén zú hábén - wérdén wir mál wiédér séhén.<br /><br />Wirklich éin páár witzigé Cháráktéré mit béi. Dié Géschicht ist nicht zú wéit hérgéhớlt. Dié Millér sind zúm Liébhábén.<br /><br />És hát wás vớn dér Téllérw&áúml;sché-Géschichté. Ná já, nicht zú viél érz&áúml;hlt.",2014-08-04,0,3,False
93,3785747411,691626223,Er ist wieder da,N,Y,Wirklich gút!!,Séhr úntérháltsám!! Ist kéiné ánsprúchsvớllé Géschichté ábér zúm rúntérkớmmén únd zúm láchén kánn ich dás Hörbúch núr wéitérémpféhlén. Viél Spáß béim zúhörén.,2014-07-31,0,6,True
95,B000MJ406Y,664599711,Behringer FBQ800 Égaliseur graphique MINIFBQ,N,Y,Mini équaliseur Top!,Petit Prix mais excellent pour gérer la bande passante (+- 12 dB)<br />de ma chaine Hi-Fi.<br />Protection contre le &#34;larsen&#34;.<br />Filtre de coupure ultra basses pour éviter les vibrations.<br />Passage rapide 6/12 dB.<br />Que du bon pour ma chaine qui ne possède pas ces contrôles car considérée comme parfaitement linéaire.,2013-02-17,2,15,True
105,B000YDOOUK,536863484,Runnin' Wild,N,N,LA CLAAAAQUE !!!!,"20 octobre : anniversaire de mon cher et tendre...coïncidence, le dernier album de son groupe favori en cadeau ! AC/DC !!!!!!chouette ? et bien non, plutôt \\""mouaif\\""...quelques morceaux sympathiques mais rien d'exceptionnel...cet exemplaire de Black Ice maintenant rangé gentillement parmi près de 30 ans de \\""collectionnite\\"" aïgue, on attend le prochain en doutant un peu. Plus de places à Bercy ? Pas grave, on court au Trabendo le 2 décembre, parce qu'AIRBOURNE, eux, nous ont mis une bonne petite claque, en plus petite salle, rien de tel pour faire bouger nos vieux os...Biz à tous les hardos et malgré tout bon concert à Bercy...nous c'est Noël avant Noël...au Trabendo !!!",2008-10-24,2,6,False
132,B00DJFIMW6,271429756,Minion Rush: Ich - Einfach unverbesserlich,N,Y,Ich einfach verbesserlich,"Spiél ist lústigér áls dér Film, dié lángén Ládézéitén kớstén állérdings éinén Stérn. Sớrry ihr Miniớns, ist nicht wirklich b&ớúml;sé géméint!",2013-08-26,0,1,True
133,B00RZPE9LY,836769352,Into the Woods : Promenons-nous dans les bois,N,Y,pas de version française !!!,attention version originale sous titré en français  dommage.Il faudrait que cela soit préciser et en gros caractère.Si cela pouvait etre fait ?,2015-06-13,2,3,True
135,B0001B3YTM,941770195,Firefly - The Complete Series [DVD] [2003],N,N,Only 5?,"We&#x27;ve been SFX-ed to death since Star Wars and Close Encounters - this series is about people. Here in Switzerland - like most places I&#x27;ve been - quality TV is lacking, and English-language programs even more so. I was given this set of DVDs by a South African colleague whose wife picked it up based purely on the cover. What incredible good fortune! OK, I&#x27;m an SF man, esp when it&#x27;s based on hard science (Asimov, Clarke, Sagan, etc), but this series is so well done, it would be crass to question why six-shooters and boots abound. The dialog is crisp, often under-stated, and has more jokes than you would appreciate after a single viewing. It&#x27;s clear that the whole crew involved in this had a great time making the series - it&#x27;s the first anything - book, TV prog, movie - where I&#x27;ve felt I actually cared for the characters in the same way as the original 60s Star Trek made us feel 40 years ago. My kids love it, and were ecstatic to see the movie Serenity when we were in New York - months before their friends could see it in Switzerland. Please - watch the TV series, then the movie. But repeat regularly - it&#x27;s worth it.",2006-02-27,1,9,True
143,B008NF45S2,433522201,PrintHand Mobile Print Premium,N,Y,Funktioniert hervorragend,"Super App. Findet Gerät schnell und unkompliziert.Mit Canon MG 6450 ohne Probleme verbunden.Da kann sich Canon eine Scheibe abschneiden,schade das Canon dazu nicht fähig ist.",2014-11-28,0,0,False
152,B00FAXJHCY,803172158,Spannend. Direkt als Drehbuch geschrieben,N,Y,The Martian,"Spánnénd únd gút géschriébén. Áls nicht NÁSÁ-Mitárbéitér schéint mir, dáss dié téchnischén Détáils rélátiv gláúbwürdig únd réálistisch wirkén. Trớtzdém áúch nicht zú téchnisch. Éin Búch, wélchés mán in éiném Rútsch dúrchliést. Hát mir viél Spáß únd Spánnúng béréitét.",2014-11-15,0,4,False
166,B005KIQ32Q,735550291,LEGO Technic - 9397 - Jeu de Construction - Le Camion Forestier,N,Y,,un lego technique à recommander aux plus grands et même aux adultes ; ça fonctionne très bien ; dommage que la pince ne soit pas motorisée !,2012-12-14,2,2,True
174,0753827662,93816562,Gone Girl,N,Y,Hard to put down...,"Wonderfully written, couldn't put it down. Great book!",2015-03-28,1,0,False
177,B00005NDRZ,541531065,Stanley Kubrick Collection : Shining,N,N,The Shining,"D'un point de vue purement cinématographique, le film est excellent grâce à l'association Stanley Kubrick et Jack Nicholson. Ce dernier se déchaîne ...<br />Un quasi huis-clos avec un suspense jusqu'au bout, et à la limite du film d'horreur, mais c'est très bien fait.<br />Il n'y a pas de bêtes imaginaires et monstrueuses mais des acteurs et rien qu'eux dans un décor tout à fait &#34;normal&#34;.<br />A voir !",2013-01-12,2,3,True
194,B004DF3S7A,991618894,Best of-the Great American Son [Import allemand],N,Y,,"Tous les CD de Rod Stewart reprenant des grands standars américains sont tres bien.Je les ai tous achetés ,et je ne me lasse pas de les écouter....j'en rachète meme pour en offrir à des amis .Sur celui ci ,j'adore particulièrement les chansons :\\""long ago and far away\\""\\""the way you look tonight\\""la chanson de Julia Roberts dans le film \\""le mariage de mon meilleur ami\\"" )\\""bye ,bye blackbird\\"" mais surtout \\""what a wonderful world\\"" avec Stevie Wonder...c'est vraiment super !",2012-07-08,0,6,True
201,B00ERIUO02,836984168,Prism - Edition Deluxe,N,N,,"Amateur de Punk/Rock/Metal, Katy Perry n'est à la base pas vraiment mon style de musique, mais son album Teenage Dream avait su me séduire avec plusieurs titres forts.<br /><br />Si Roar restait plus ou moins dans la ligné du précédant album, j'ai trouvé les autres pistes moins accrocheuses même si y'a quelques titres sympathiques. Verdict ce \\""Prism\\"" est pas mal mais pas aussi bon que je l’espérais.<br /><br />Coté support vous trouverez un album en édition cartonnée solide mais qui ne se ferme pas comme pourrait se ferme un boitier classique, le livret de paroles et un triangle en carton pour respecter le titre de l'album.<br /><br />Bref hormis les 3 chansons pas exceptionnelle et son emballage carton cette édition deluxe aurait pu être mieux fournie (photos supplémentaires? un dvd live?).",2013-10-23,2,6,True
245,B000069CWE,885835289,Reanimation,N,N,F&uuml;r eine Remix CD absolut spitze!,"Mein Gott, warum muss immer alles geremixt werden, warum kann man nicht einfach einen Song raus bringen und es dabei belassen?? Das ist eigentlich meine Meinung zu Remix-CD's. Doch &bdquo;Reanimation\\"" ist mal eine richtig gute Remix CD!! Ich m&ouml;chte sogar behaupten, dass einige Remixe fast noch besser sind als die Originalversionen, obwohl die neuen Versionen wirklich nicht mehr allzu viel mit dem Originalstil von Linkin Park zu tun haben. Die Remixe gehen in alle m&ouml;glichen Richtungen. Der Remix von &bdquo;Crawling\\"" hat z.B. fast schon einen klassischen Hauch, &bdquo;Forgotten\\"" geht in eine geniale HipHop Richtung, wobei andere &bdquo;Neumischungen\\"" fast noch h&auml;rter als das Original sind (z.B. With you). Es ist also nicht eine reine HipHop-Remix-CD - wobei das schon &uuml;berwiegt -, aber Abwechslung wird auf jeden Fall geboten. Bei diesen Experimenten ist eine geniale CD raus gekommen, die sich absolut sehen lassen kann und sich hinter der &bdquo;Hybrid Theory\\"" wirklich nicht verstecken muss.<br />Meine Favoriten habe ich schon erw&auml;hnt, das w&auml;ren zweifelsfrei &bdquo;KRWLNG\\"" und &bdquo;FRGT_10\\"". Aber &bdquo;ENTH E ND\\"" und &bdquo;WTH_YOU\\"" sind auch sehr gut gelungen. Nat&uuml;rlich gibt es auch ein paar St&uuml;cke, die schlicht und einfach nicht gut sind, aber es w&auml;re sehr verwunderlich gewesen, wenn jeder Remix ein Hit w&auml;re, so was ist fast ein Ding der Unm&ouml;glichkeit. 2, 3 Songs sind wirklich total schlecht, und es wird einem fast sogar gleich der Spa&szlig; an der Originalversion verdorben, weil man dann immer diesen Remix im Ohr hat, aber es h&auml;lt sich doch noch in Grenzen, h&auml;tte weitaus schlimmer sein k&ouml;nnen. Alles in allem also eine sehr gute CD, bei der man den Kauf bestimmt nicht bereuen wird.",2004-07-04,0,6,True
246,B000ZMX8CU,739717256,Vox Amplug Classic Rock Guitar Headphone Amplifier,N,N,Vox amPlug Classic Rock,"A great sound for the money, and comes pretty close to a full 'hard' rock sound.   It's ideal for practicing, when you -  a) Can't be bothered to drag out the full amp/effects setup.  b) Have noise restrictions.    The construction feels/looks quite plasticy and cheap, so not sure how long it will last (But I haven't had an issue so far); hence the 4 stars instead of 5.",2010-03-05,1,13,True
250,B0009PAVI2,223587242,Très bien,N,N,Tamrac TA-Y536301 Etui Noir,"Le produit correspond à mes attentes : une pochette simple et robuste pour emporter facilement mes filtres photos avec moi tout en les protégeant. Les  poches les plus grandes accueillent sans difficulté des filtres de 77mm, celle de devant est un peu plus étroite.",2011-02-01,0,5,True
255,B000M05W10,243283747,Jerry Maguire,N,N,Career Politics In the Sports World,"In Jerry Maguire , Tom Cruise gives a substantial portrayal as a sports agent who is forced to reinvent himself (careerwise) after he is fired by the same guy that he mentored. He was writing for Sports Management International and had written a mission document type of book that caught the interest of an accountant in his office named Dorothy Boyd (Renee Zellweger). The character of Boyd also becomes important in the movie because she is the one who follows Maguire, despite  the uncertainty, after he is let go from his job. Maguire’s former prot&eacute;g&eacute;e secures most of his previous clients. Luckily for Maguire, he at least is able to successfully make a deal with Rod Tidwell, a professional football player (played by Cuba Gooding Jr.).",2014-04-19,2,3,False
266,0446343129,484346258,Sugar Blues,N,N,Kick your sugar habit and start feeling great!,I came upon this book in the Library and I just thought I would take it  home and read it for fun.  I had no idea this would change my life.  This  is a thoroughly researched and detailed book but only for those people with  open minds. After reading the book I tried to locate a copy to keep but I  could not even find this book at a national chain. Good old Amazon had it.   I am now on an anti sugar crusade and when anyone asks me I tell them about  Dufty's book.  I have also begun purchasing several at a time and giving  them to people I feel are open to learning and changing themselves.,1998-09-18,0,0,True
274,0395177111,276015944,The Hobbit,N,N,This is a story that grows with the reader.,"In a mythical or maybe just forgotten time, many creatures lived in places like the Shire, home to Bilbo Baggins, Hobbit. Hobbits are comfort loving creatures with no real sense for adventure. A knock on the door and Bilbo's life is about to change.<br />Calling this book children's book is like calling &quot;Alice in Wonderland&quot; [see \\""The Annotated Alice\\""] a children's book. Yes children can read this book and it is fun. How ever there is a lot more to this book than a cute story. And it has all the depth of the other Tolkien works with the exception of being shorter.<br /><br />Many people look at this story as a prequel to \\""The Lord of the Rings\\"", where in reality it is a stand-alone story with a perfectly good beginning, middle, and end. When you read &quot;The Lord of the Rings&quot; there is enough description to forgo &quot;The Hobbit.&quot; Personally, I find that reading The Lord of the Rings first gave me the in-depth background to better appreciate The Hobbit.<br />Many of the creatures and adventures will put you on the edge of your seat. You will recognize the personalities and grow along will Bilbo as he faces new challenges as he learns to deal with life.<br />A good book to read first would be \\""The Power of Myth\\"" by Joseph Campbell. Then you get a clearer picture of why the story progresses as it does.",2005-07-17,0,0,True
275,1856130924,960644313,Jamie at Home - Cook Your Way to the Good Life,N,Y,"Amazing quality of food, pictures and stories","This book is amazing. The food is delicious and easy to make, the pictures and stories troughout the book are just lovely! the book was second-hand, but it's still in great condition. Go buy it and cook for your loved ones",2013-06-10,1,0,True
299,B001D6OKZ6,361884839,lost saison 4,N,Y,Lost - Intégrale saison 4 [Blu-ray],lost saison 4 bâclé à mon avis heureusement qu'il y a 13 episodes. c'est la pire saison de lost les meilleures reste les trois premières. pour cette saison ça ni queue ni tête ça ne reste pas dans l'esprit de la série même si les acteurs actrices jouent très bien heureusement que la 5 et 6 saison s'améliore.,2014-07-25,2,3,False
303,B0002KVEY4,58840195,Misery [Édition Simple],N,Y,,J'adore Stephen King. J'ai lu le livre alors j'ai décidé d'acheter le DVD. Je suis une inconditionnelle de Stephen King.,2013-11-06,2,3,False
306,B00CEZJT2E,137542365,Anker Astro Slim3 6000mAh Ultra-Slim Portable Charger ​External Battery Power Bank with Built-in Micro USB Cable for USB Devices (Black),N,Y,I could not be more pleased at this point,"Really positive first impressions. For a start it feels quality coming out of the pack. It comes with a full charge on it. I tried it by charging up my S3 from 83% to 100% which took no more than 20 mins and it still shows full 4 lights on the device itself, denoting full ish charge remaining.<br />I could not be more pleased at this point.",2014-08-03,1,13,False
317,B0031RS2HC,208059136,"Killing Floor (Jack Reacher, Book 1)",N,Y,ok!,"New to this genre, not too sure if I'll get anymore, and not sure where the hype about this book came from, over complicated plot, yet simple at the same time. Also full of fluffing out with over thoughtful and dressed up thought processes and descriptions!",2014-06-01,1,4,False
318,B007FOH7UU,733612379,Strangeland,N,Y,Eines der besten Alben von Keane ...,"... wenn nicht gar DAS BESTE:.<br />Ich habe mittlerweile jedes Album der britishen Band KEANE, und kann für mich sagen der Kauf hat sich mehr als gelohnt.<br />Ins Ohr gehende Stücke und ansprechende Texte, gepaart mit Tom Chaplins Stimme! Die Experimente der/des  letzten Albums sind vergessen, das hier enthält alles was KEANE ausmacht.<br />Kaufempfehlung!",2013-04-22,0,6,False
321,B00K7ED57Y,314993871,The Children Act,N,Y,As reading should be.,A beautifully written and very touching story.,2015-01-16,1,4,False
322,B00B2QG3K2,819456826,Paramore,N,Y,Was ist denn hier passiert?,"Lange, lange habe ich darauf gewartet und das ist es nun. Das neue Album von Paramore.<br />Nach \\""Monster\\"" hatte ich doch starke Hoffnung darauf, dass die Band ihrem Stil treu bleibt, doch das hier geht ja in eine komplett andere Richtung. Vergeblich suche ich nach Songs wie \\""Crushcrushcrush\\"", \\""Ignorance\\"", \\""Misery Business\\"", \\""Emergency\\"", etc. Anstatt schön rockiger Lieder mit anständigem Inhalt bekommt man hier zum Teil langweilige Popsongs mit lahmen Texten geboten. Alleine wenn ich mir nur \\""Fast In My Car\\"" anhöre kann ich nur fassungslos mit dem Kopf schütteln. Der einzige Song den ich einigermaßen mag ist \\""Part II\\"" und auch ihre Single \\""Now\\"" finde ich nicht so schlecht.<br /><br />Vielleicht sollte ich mir es noch einmal zehn Mal anhören, möglicherweise mag ich es dann lieber. Doch ganz ehrlich, ein gutes Album muss einen schon weghauen wenn man es zum ersten Mal hört und das haben Paramore eindeutig nicht geschafft. Trotzdem hoffe ich leise weiter, dass sie vielleicht doch noch zu ihrem alten Sound zurück kommen, auch wenn ich das bezweifle.<br />Schade.",2013-04-05,0,6,True
333,B008P1EWIM,67489912,Wetter Live - Detaillierte Vorhersagen und Live-Wetterbedingungen,N,Y,Schade...,"Diese App hat mir bisher eigentlich sehr gut gefallen, detaillierte Infos &uuml;ber das Wetter, Luftfeuchte, Regenvorschau, auch sch&ouml;n gemacht die wechselnde Hintergrundanzeige je nach Wetterlage, etc.<br />Leider f&uuml;r mich nun nicht mehr brauchbar, da ich st&auml;ndig 'ne Fehlermeldung bekomme und ich mich irgendwo anmelden muss. Bis dato super, aber nun kommt sie runter.",2015-04-11,0,1,True
342,B00005N6RU,219463060,The Birds [DVD],N,Y,the birds,"I love this oldie how they got the birds to attack people , very good film",2015-04-04,1,3,False
346,B000059GTD,840111210,Gladiator - Edition Collector 2 DVD,N,N,Dans la plus pure tradition ... moderne,"Pas de risque, c'est un péplum, un vrai, comme on n'en faisait plus depuis longtemps. Avec les moyens techniques actuels on pouvait peut-être espérer des effets nouveaux, des sensations inconnues.  Mais tant mieux, on retrouve le plaisir intact sans (impression du moins) décor carton pate ! L'histoire est presque sans surprise mais n'en reste pas moins crédible et intéressante.",2001-04-18,0,3,True
347,B00E3V7R9Y,359966675,"Predator [Édition Limitée ""Tête du Predator"" - Blu-ray 3D/2D + DVD + DVD bonus]",N,N,,tres beau coffret bien fait et le rendu est superbe franchement a ce prix trop content de cette achat depuis le temps,2015-08-24,2,3,False
350,B00F2N3MU0,167905699,Clandestino,N,N,,J'ai découvert cet artiste par ces deux titres &#34;Clandestino&#34; et &#34;Esperenza&#34; que je ne me lasse pas d'écouter. L'ambiance latino est très agréable et entraînante. Elle capte rapidement notre esprit et nous fait vite oublier le quotidien le temps de l'écoute. A consommer sans modération !,2014-08-09,2,3,False
353,B00006690G,927293345,The Eminem Show,N,Y,E&ugrave;inem. Fred.,Super CD de rap. Il n'y a presque que rien de mauvais dans cet album. J'ai entendu des remix excellentes en Hardtek et Hardcore gr&agrave;ce &agrave; ce CD. Pour r&eacute;sumer super album!!!!!.,2015-03-13,2,6,False
379,B00JDXFR6C,162064352,Xscape,N,Y,,ça fait plaisir d'entendre de nouveau le roi de la pop. 1 morceau très bon et 2 très sympa.<br />En téléchargement à 5.99 c'est correct. Je suis ravis de mon achat. Merci Mickael et RIP.,2014-05-30,0,12,False
380,B00BG4RLF6,416731645,Overgrown,N,Y,Simply Soulful,"I love it when a song stops me in my tracks, that's what happened when I first heard Retrograde on Radio 6. The album hasn't disappointed me, as often happens when buying a CD from an unknown artist. James Blake's haunting voice weaves it's way through the songs beautifully, and creates music quite unlike anything else I've ever listened to before. Music that speaks to your soul!",2013-04-10,1,6,True
389,B00004CX9A,566070903,Ransom [DVD] [1997],N,N,Mel Gibson AGAIN,"If it weren't for Mel Gibson's absolutely dreadful acting this would have been quite a good thriller. Sadly Mel Gibson's neurotic, melodramatic style is better suited to Mad Max and Lethal Weapon where there is little need for such subtleties as character and empathy. Rene Russo doesn't inject much realism into her character either unfortunately, but then playing opposite Gibson perhaps it's not altogether surprising.<br />In other respects this was quite an engaging thriller with various twists and turns which keep the viewer watching. When one character almost has his head beaten to a pulp by Gibson - a wealthy business magnate, not a violent character from Lethal Weapon - and is then able to stand and run with hardly a mark on him, it is necessary to suspend belief beyond the call of duty. But otherwise the story line hangs together reasonably well.",2012-06-10,1,3,True
401,B008DNNX6O,921899053,Anastasis,N,N,Je länger die Abstinenz desto größer offensichtlich die Ansprüche...,"...anders kann ich mir nicht erklären, warum die neue Dead Can Dance neben gutem auch relativ viel kritisches Feedback bekommt.<br /><br />Mag sein, dass die Produktion ökonomischer geraten ist als früher, aber an Songs wie Children Of The Sun, Amnesia, Opium, Return Of The She-King und All In Good Time gibts ja nun wirklich nicht viel auszusetzen. Das sind für mich neue DCD-Klassiker.",2012-11-30,0,6,False
405,B00PTB7B34,959579423,Call of Duty®: Heroes,N,Y,sami,Very addictive cool game to have on kindle fire,2015-08-06,1,13,False
413,B00009ZT91,791010761,,N,N,"Charlie's Angels 2, Les Anges se déchaînent","Ce film est simplement épustouflant!!!!<BR>L'intrigue est passionnante à l'extrême, les personnages si drôles et attachants et les effets spéciaux si impressionants, que ce serait une faute de ne pas aller voir ce film et d'en acheter plus tard un DVD!!!<BR>Les actrices sont exceptionnelles et surtout Cameron Diaz, aussi brillante que d'habitude. Ce film est hilarant!!!<BR>ALLEZ LE VOIR D'URGENCE!!!!!!!!!!",2003-06-26,2,1,True
