,product_id,product_parent,product_title,vine,verified_purchase,review_headline,review_body,review_date,marketplace_id,product_category_id,label
8818,B0001Z2Q7O,824902601,Die Passion Christi,N,N,Éin schớckiéréndés Méistérwérk!,Diésér Film ist définitiv nichts für schwáché nérvén. Ich gébé zú dás diésér Film définitiv in viélén Szénén séhr ins Détáil géht. Vớr állém dié Géwált Dárstéllúng ist séhr ớft fást zú éxtrém únd mán dénkt ớh néin dié wérdén dás dớch jétzt nicht wirklich zéigén.  Dénnớch zéigt dér Film dié létztén Stúndén Jésús Christús séhr gút érzählt. Rückblické in béstimmtén Schlüssél Mớméntén zéigén éinigé Gégébénhéitén vớn dénén mán ớft in dér Bibél ớdér in Bibél Géschichtén géhört hát. Gérádé diésé Szénén vérléihén éin séhr gútés Bild únd mán érkénnt viélé Géschichtén wiédér únd hát jétzt viélléicht éhér mál éin Bild dáhintér áls núr éiné Érzählúng. Dér Film ist ábsớlút émớtiớnál wás éinén nicht gánz kált lässt. Sichérlich ist dá áúch dié stárké Gésámtdárstéllúng éin Grúnd dáfür.     Für jédén dér sich für dén Léidénswég vớn Jésús intéréssiért bzw. Dér réligiös ist éin Film dén mán séhén múss. In viélérléi Hinsicht ist dér Film définitiv úm éinigés béssér áls dié viélén áltén únd in méinén Áúgén viél zú lángén Filmé.  Dénnớch múss áúch ich wié viélé ándérén ságén dás dér Film ábsớlút nicht áb 16 Jáhré fréigégébén séin sớllté únd gérádé für diésé Áltérsgrúppé úngééignét ist. Dér Film mácht éiném sichérlich éin wénig zú scháffén.,2011-05-05,0,3,True
8820,B001KYNCIM,904939428,Righteous Kill [DVD],N,Y,Four Stars,Speedy delivery and good price. Many thanks. Jaws71,2015-08-27,1,3,False
8861,B0054NZ4MM,898855259,Sanctum [3D Blu-ray],N,Y,Sanctum 3D,"Der Film basiert auf einer wahren begebenheit. Die Geschichte war top, und auch das 3D vergnügen ist nicht zu kurz gekommen. Diesen Film kann ich wirklich nur empfehlen. Natürlich ist er auch in 2D sehr gut.",2011-12-09,0,3,True
8862,B000VZZSJC,683164597,High School Musical 2 - Extended Edition [DVD],N,Y,Total waste of money,It kept pausing and skipping! Total waste of money.,2015-08-26,1,9,False
8865,B004L2KQOI,480476510,Au-delà,N,N,Un bon film,"Clint Eastwood s'essaie au genre de la science fiction / du paranormal, et c'est plutôt réussi.<br /><br />Bon, on a pas affaire à un film d'action ni à un film catastrophe. Plutôt à l'évolution de 3 intrigues et 3 personnages qui seront amenés par les aléas de la vie à se rencontrer. On va réfléchir avec eux au sens de la vie et à notre propre relation avec la mort.<br /><br />Tout en finesse, Eastwood joue les chefs d'orchestre d'une oeuvre injustement critiquée à mon sens.<br /><br />J'ai bien aimé",2014-04-28,2,3,False
8866,B004L21EF8,6696857,The Walking Dead - Die komplette erste Staffel (2 Discs + O-Card)  [Blu-ray],N,N,Ich liebe diese Serie,Ich muss Zugeben das ich süchtig danach bin. Bin ein bischen enttäuscht das die Bild und Ton auf Blueray nicht wirklich besser ist als wie die DVD. Aber mir gefällt es trotzdem.,2013-05-21,0,3,True
8869,B00B2FLDRQ,274604361,The Rosie Project: Don Tillman 1 (Don Tillman Series),N,Y,Great fun - lives up to the hype!,Loved it - great holiday read with a different perspective on finding love,2015-08-09,1,4,False
8876,B00CTNKWX6,301267682,Can't Get Enough (Limited Edition),N,Y,can't get enough (limited edition),"Gúté Qúálität dér Schéibé, wér Álté Schúlé mág ist hiér génáú richtig. Kéin máinstréám - écht állés hándgémácht!<br />Án diésér Schéibé hát mán viél Fréúdé.",2014-03-16,0,16,True
8904,B005KIQ2YA,595500527,LEGO Technic - 9395 - Jeu de Construction - Le Pick-Up Dépanneuse,N,Y,parfait,mon fils de 13 ans adore ces lego et ils sont vraiment beaux et de belle qualité je recommande ce jeu parfait,2014-12-01,2,8,False
8917,B00IJ89SKS,457561166,Pompéi - Blu-ray 3D [Combo Blu-ray 3D + Blu-ray 2D],N,Y,3 D active,C'est ma première expérience à domicile en 3 D active. l'image sort de l'écran. Ce film se prête bien à la 3 D,2015-01-13,0,3,True
8919,B00B0IIY04,831721800,LEGO The Lord of the Rings 79006: The Council of Elrond,N,Y,"small but looks good, very well designed.","A very elegant small set that captures the scene surprisingly well, though it does get rather crowded if you try to include the complete company on the stage.  Now if only I had the parts to make more or Rivendell...",2014-10-09,1,7,False
8938,B00NXAA2LQ,870348226,R. Strauss : Vier letzte Lieder - Ein Heldenleben,N,N,Regrettable ...,"L'affiche promettait, la déception est totale. Après des superbes enregistrements où elle chantait dans des registres qui faisaient sens, Anna Netrebko se plante tout simplement dans l'un des plus beaux cycles de lieder du répertoire. Aucune émotion ne pointe, le timbre force, grossit sans grâce. C'est consternant de vide et de neutralité, un comble pour ces 4 derniers lieder. Passez votre chemin, pour curieux ou amateurs invétérés. Dommage",2015-03-06,2,6,True
8942,B00JIR8U3U,109782764,Noah,N,N,Ein biblischer Müll!,"Leider kann man nicht 0 Sterne verteilen!<br />Finger weg!  Von Anfang bis Ende, langweilig und doof. Selbst die Effekte taugen nix!",2014-08-29,0,3,True
8948,B00H2FQ18G,465887729,The Amazing Spider-Man 2 - Limited Edition with Comic Booklet (Amazon.co.uk Exclusive) [Blu-ray] [2014],N,Y,Five Stars,once you see one you cannot wait to see more,2014-10-25,1,3,False
8955,B00AEFXN46,908846386,Chinatown [Blu-ray] [Import anglais],N,Y,Le chef d'oeuvre de Polanski,"En Blu-Ray, ce film magistral prends encore une autre dimension.<br />La beauté des images et de la musique, les détails sonores ou bien visuels, tout ici concoure à faire de Chinatown une expérience cinématographique inoubliable.<br />Scénario, dialogues, interprétations, mise en scène, nous frôlons la perfection; rien ne semblent devoir être ajouté ou retranché de ce qui restera comme un des plus grand film noir, même si réalisé dans les années 70.<br />Jusqu'à cette fin brutale, amorale et lucide, comme rarement vu au cinéma.<br />Du grand art.",2015-08-09,2,3,False
8964,B009PPMX42,830403126,Jason Bourne - L'Intégrale - [Edition Limitée - Boitier Métal ] - Intégrale DVD 1 à 4 [Pack Collector boîtier SteelBook],N,Y,,"Ayant déjà vu trois films sur les quatre, il était normal que je m'achète l'intégrale. Un boîtier au look en tout point identique à la photo, aucun problème...",2013-03-29,2,3,True
8971,B009Z62JAE,371750745,Quebec Magnetic,N,Y,un dvd mythique,"Au Qu&eacute;bec les mets donne tout , en mette plein les yeux , avec une energie que seul eux sont capable de produire sur sc&egrave;ne !<br />les titres s'enchaine bien , le public est a fond derri&egrave;re eux . achetez le sans h&eacute;sit&eacute; !",2014-12-09,2,1,False
9001,B00005MHNB,872883057,The Last Of The Mohicans [1992] [DVD],N,Y,Fantastic,Absolute brilliant movie. A must watch film. My favourite Daniel day Lewis movie by far. Love the scenery and the enchanting music from clannad.,2013-05-23,1,3,False
9013,B00005V33A,383229535,Brain Salad Surgery - Miniatur [Import anglais],N,N,ELP's Masterpiece Speaks of A New Clear Dawn,"This 1973 ELP album with the original painting by H. R. Giger is one of the great covers of all time and if you really pay attention to the details in the artwork you can figure out what &quot;Brain Salad Surgery&quot; means in British slang terms. For me this is the best album by the Progressive (nee Classical) Rock Power Trio. The synthesizer-saturated sound that dominated &quot;Tarkus&quot; has been toned down considerably to great effect, which you can tell immediately with the opening organ chords of Keith Emerson's organ on &quot;Jerusalem,&quot; the best-known Anglican hymn. &quot;Toccata,&quot; an adaptation of the 4th Movement of Ginastera's 1st Piano Concerto features an impressive percussion movement from Carl Palmer. &quot;Still...You Turn Me On&quot; is Greg Lake's best composition since &quot;Lucky Man,&quot; and you can only wish his work had not always been so overshadowed by Emerson's pyrotechnics on the keyboard. &quot;Benny the Bouncer&quot; is another one of those annoying little honky tonk ditties that ELP was so enamored of for some reason that passeth understanding.<br />The highlight of the album is the &quot;Karn Evil 9&quot; Suite, which seems to me to be a nice synthesis of what the group had gone for in earlier albums with the &quot;Tarkus&quot; Suite and &quot;The Endless Enigma,&quot; although more like the latter of that particular pair in terms of employing the forms of classical composition. The First Impression offered the line that came to sum up the group's performance, &quot;Welcome back my friends to the show that never ends,&quot; although you find yourself wishing they had used computer magic to get rid of the fade out/fade in that we had to endure on vinyl when we flipped sides of the record. The Second Impression is arguably their finest instrumental track while the Third Impression brings the album full circle, offering a hymn for the new clear dawn. To make this album perfect all you have to do is program your CD player to skip the fourth track. Enjoy.skip the fourth track. Enjoy.",2005-07-18,2,6,True
9029,B000MCIBMK,38733699,And Then There Were Three (2007 Remaster + DVD Bonus),N,N,R&eacute;habilitation...,"\\""And then there were three\\"" a toujours &eacute;t&eacute; consid&eacute;r&eacute; comme un album bancal et ce, pour de multiples raisons...<br /><br />D'abord, c'est le premier album &agrave; 3 de Genesis, marquant le d&eacute;part de Steve Hackett, donc changeant compl&egrave;tement les caract&eacute;ristiques du son de Genesis et la mani&egrave;re dont sont faits les arrangements.<br /><br />Ensuite, il fut publi&eacute; en 1978, date de l'explosion \\""punk\\"" o&ugrave; Genesis fût alors taill&eacute; en mille pi&egrave;ces par la critique anglaise.<br /><br />Et enfin, il marque la premi&egrave;re vraie incursion dans les hits-parades et l'ouverture v&eacute;ritable vers l'Am&eacute;rique grâce au titre \\""Follow you, follow me\\"".<br /><br />Donc, un album forc&eacute;ment de transition, aujourd'hui encore rejett&eacute; par ses auteurs, qui b&eacute;n&eacute;ficiait jusqu'&agrave; cette version d'un mixage horrible, lorgnant vers les aïgus avec des sons de claviers omnipr&eacute;sents qui &eacute;crasaient tout le reste, chant et batterie inclus !<br /><br />Grâce au nouveau remixage, l'album semble comme... \\""transfigur&eacute;\\"", &agrave; la limite d'être un nouveau disque !<br /><br />Le chant de Collins est enfin restitu&eacute; dans toute sa splendeur et dirige les chansons et ses parties de batteries et percussions, parfois extrêmement recherch&eacute;es et dynamiques, soutiennent enfin la musique qui se veut au d&eacute;part plus abordable.<br /><br />On peut red&eacute;couvrir quelques grands titres (le solide \\""Deep in the motherlode\\"", l'amusant \\""Scenes from a night's dream\\"" ou l'extraordinaire \\""The lady lies\\"", l'un de mes 10 titres pr&eacute;f&eacute;r&eacute;s du groupe)<br /><br />Certes, question compositions, on a plus l'impression d'avoir un recueil de chansons de Banks d'une part et Rutherford de l'autre, que d'une vraie alchimie commune cr&eacute;ative.<br /><br />De plus, Banks, apr&egrave;s avoir pondu des chefs-d'oeuvres aux multiples rebondissements, propose ce coup-ci des morceaux plus ramass&eacute;s, voir simples (la superbe ballade \\""Many too many\\"") et Rutherford s'embourbe un peu dans ses ballades (\\""Say it's alright Joe\\"", \\""Snowbound\\"")...<br /><br />L'album n'est pas un chef-d'oeuvre donc et le groupe n'avait pas encore trouv&eacute; la mani&egrave;re dont il allait fonctionner en trio, mais cette nouvelle version fait beaucoup mieux que le r&eacute;habiliter...<br /><br />Mal-aim&eacute; ou sous-estim&eacute;, il regagne enfin grâce &agrave; ce remixage quelques gallons et on prendra du plaisir &agrave; appr&eacute;cier la version en 5.1 autant que celle st&eacute;r&eacute;o (&agrave; noter que le titre \\""Say it's alright Joe\\"" est le seul &agrave; avoir &eacute;t&eacute; remix&eacute; d'une mani&egrave;re artificielle, les bandes masters du titre ayant disparu)oeuvre donc et le groupe n'avait pas encore trouvé la manière dont il allait fonctionner en trio, mais cette nouvelle version fait beaucoup mieux que le réhabiliter... <br /> <br />Mal-aimé ou sous-estimé, il regagne enfin grâce à ce remixage quelques gallons et on prendra du plaisir à apprécier la version en 5.1 autant que celle stéréo (à noter que le titre \\""Say it's alright Joe\\"" est le seul à avoir été remixé d'une manière artificielle, les bandes masters du titre ayant disparu) <br />",2007-05-28,0,6,True
9069,B001FB5G98,101257542,Mamma Mia! - Der Film,N,Y,Genau das was ich wollte,"Das Produkt kam zum versprochenen Zeitraum an und war ohne äußere Mängel und sofofrt einsatzbereit.<br />Ich würde es wieder bestellen, da ich mit dem Service komplett zufrienden bin.<br />Das Produkt bekommt von mir 5 Sterne :)",2014-10-14,0,3,False
9072,B00GFOG88I,670315206,Be Careful What You Wish For (The Clifton Chronicles series Book 4),N,Y,Four Stars,"A good read, lots of twists to the story.",2015-01-02,1,10,False
9073,B001QB0IZY,63233157,"James Bond 007 - Ein Quantum Trost (Special Edition, 2-Disc Wende-Steelbook) [2 DVDs]",N,N,Nách dém béstén nún éinér dér schléchtéstén,"Ich war wohl bei keinem Bond-Film im Vorraus so gespannt wie bei diesem. Denn nach dem, meiner Meinung nach, wenn auch knapp, besten Film der Reihe und der Aussagen der Produzenten, dass die Story direkt an den Vorgänger anknüpfen würde, war die Vorfreude doch bei Vielen am Siedepunkt.  Nach der Eröffnungssequenz, einer wahnsinnig rasanten und auch durch den Kameraschnitt wohl so noch nie dagewesenen Autoverfolgungsjagd um den Gardasee, war ich nicht mehr zu halten. Doch nach einiger Zeit merkte ich, irgendwie kommt kein richtiges Bond-Feeling auf. Ich ging aus dem Kino und entschied mich den Streifen eine Woche später nochmals im Lichtspielhaus anzusehen. Danach konnte ich mir ein klares Urteil bilden.    Der Schnitt, der als revolutionär galt, und der in den Anfangsminuten noch so überzeugen konnte, war im Endeffekt wohl der Hauptgrund für einen eher mittelmäßigen Dum-Dum-Action-Streifen. Sicherlich experimentieren die Produzenten mit allerhand aus und hatten damit auch schon überwältigenden Erfolg, doch mit dieser Technik sind sie mal richtig aufgelaufen. Wenn man wirklich sekündlich abrupt hin- und herschneidet kann man wirklich keinen schönen Eindruck von den einzelnen Szenen bekommen. Daniel Craigs Leistung stell ich nicht mal in Frage, denn ihm wurde es auch unmöglich gemacht Gefühle oder Humor durch Mimiken an den Zuschauer zu übermitteln, da man so schnell immer wieder einen anderen Blickwinkel vorgesetzt bekommt. Allerdings ist die Besetzung der weiteren Rollen leider auch nicht optimal vollzogen worden. Olga Kurilenko als tja soll man sagen Bond-Girl \\""Camille\\"" ist wohl ein absoluter Fehlgriff. Trotz großer Rolle hinterlässt sie in keiner Szene einen bleibenden Eindruck. Ähnlich fad war wohl nur Tanya Roberts als \\""Stacey Sutton\\"" in \\""Im Angesicht des Todes\\"". Auch der von Mathieu Almaric verkörperte Bösewicht Dominic Greene ist kein Treffer. Die ganze Figur hat überhaupt keinen Charakter. Selbst in meinem Heimatdorf findet man mehreresolche Personen auf der Strasse (bei ca. 750 Einwohnern!).    Auch die Story ist leider nicht fesselnd. Blofeld wollte damals wenigstens noch die Weltherrschaft, schrieb ein anderer Rezensient. Man kann nur hoffen, dass dieser Film quasi als Bindeglied zwischen \\""Casino Royale\\"" und \\""Bond 22\\"" steht und vielleicht die Story um die Organisation \\""Quantum\\"" nur erst richtig einleiten soll. So einen Superbösewichten wie in den Sean Connery Filmen oder ein Syndikat, welches über mehrere Filme Gegner Bonds bleibt, ähnlich wie SPECTRE damals würde der Serie vielleicht gut tun.    Der Film ist ein ordentlicher Actionstreifen, der aber mit seinen Vorgängern nicht mithalten kann. Auch die Tatsache dass dies der kürzeste ist trägt dazu bei, hoffentlich bleibt er es. Wer einen kurzweiligen Blockbuster mit viel Action und wenig durchdachter Story sehen will ist hier richtig.    Auf der zweiten Disc sind Dokumentationen über die Dreharbeiten, die Musik und ein Interview mit Regisseur Marc Foster vorhanden. Außerdem findet man das Musikvideo zu \\""Another Way To Die\\"" und verschiedene Trailer.    1 Stern weil James Bond  1 Stern da doch ein ordentlicher Actionfilm  1 Stern für das Aufbauen der Story und dem offenen Ende  =  3 Sterne",2010-07-09,0,3,True
9074,B00MFPYWQ6,647130552,Lucy,N,N,Déception...,"Je ne sais pas ce qu'est devenu Luc Besson réalisateur culte des années 80 / 90. Quant à Luc Besson producteur, j'ai bien l'impression qu'il se contente d'appliquer des formules toutes faites...<br /><br />Franchement, prenez une bonne dose de Nikita, un soupçon du cinquième élément, une goutte de Taxi, secouez bien, vous obtenez cette chose sans grand intérêt qui s'appelle Lucy.<br /><br />Partant d'une idée de départ qui pouvait faire travailler mon imagination quand j'étais collégien (que ferait-on si on utilisait 100 % de notre cerveau), ben on a en fait une course poursuite d'1h20, sans aucun traitement des personnages, un scénario bien mince et des effets spéciaux parfois bien moyens...<br /><br />Vite vu et très vite oublié...",2014-12-21,2,3,True
9077,B0002JKPP4,432478869,the best one,N,N,Shangri-La,"C'est d'après moi LE meilleur album solo de Mark Knopfler. Certes les envolées guitaristiques sont moins présentes qu'auparavant, mais cela laisse plus de place à ses musiciens pour s'exprimer, et ce n'est pas plus mal vu leur talent. On notera donc la très grande performance de Richard Bennet, guitariste sur les albums solos de Mark Knopfler depuis Golden Heart en 1996. C'est toute l'experience de Mark et ses affluences nombreuses qui ressortent dans cet album. Achetez-le vous ne serez pas déçus!",2005-01-07,0,6,True
9115,B0062JJWNY,154718663,Les Aventures de Tintin : Le Secret de la Licorne,N,Y,CADEAU,"J'ai acheté ce film pour mon fils qui a apprécié.pour le peu que j'ai vu, j'ai trouvé ça bien.Bonne qualité! Merci.",2013-01-10,2,3,False
9121,B0033AGJ5Y,718534337,Eat Pray Love [Import anglais],N,Y,Bof,"Gentil à voir, mais cela ne m'a pas vraiment convaincue. Les transitions entre les différents pays m'ont parues artificielles. Dommage, car le sujet est intéressant.",2015-01-02,2,1,False
9127,B00AREIAI8,265040255,My Horse,N,Y,Gem system wertet die spielbarkeit leider ab,"Sch&Atilde;&para;nes Spiel.nur leider muss man,um einigerma&Atilde;en voranzukommen,die edelstein kaufen,was den Wert einer gratis-app doch deutlich abwertet.spass macht es dennoch f&Atilde;&frac14;r zwischendurch.Pferd kraulen,f&Atilde;&frac14;ttern,mal bissel turnierreiten<br /> und dann muss man eh wieder pausieren.",2014-01-11,0,1,False
9130,B000087JI1,656381957,Spirited Away [UK Import],N,N,Travels In One Spirit Land,“Spirited Away” involves the journey that a young girl named Chihiro embarks on after finding her parents transformed into pigs. She also travels through an even more unusual spirit world and dealing with the witch who was responsible for what happened to her parents. “Spirited Away” reminds me of “Howl’s Moving Castle” (which is also a good film).“Spirited Away” is a great anime movie with supernatural/spiritual themes.,2013-07-22,3,3,False
9131,B007QU5GXS,25717469,Avatar - Aufbruch nach Pandora 3D [3D Blu-ray],N,Y,super Film,Ich kannte ja bereits den Film in 2D. Zu meinem neuen Ferseher wollte ich ihn nun in 3D kennen lernen. Die 3D-Darstellung hatt meine Erwartungen voll übertroffen.,2013-01-02,0,3,False
9135,B000N3TXUM,588860149,Eragon - Das Vermächtnis der Drachenreiter,N,N,Fließband-Ware,"Äh,...Hállớ? Ist és mál wiédér sớwéit, dáß mánchés Stúdiớ dénkt, mán könnté áúf dér inzwischén ábébbéndén Wéllé vớn \\""Mittélérdé-únd-ándéré Schwárz/Wéißwélt\\""-Filmén dớch nớch éin Stückchén mitréitén únd Kớhlé ábschéfféln?    Ich hábé séltén éinén dérárt fántásiélớsén Fántásystréifén ánséhén müssén, in dém ábér áúch gár nichts zúsámménpáßt. Béi \\""Érágớn\\"" wúrdén múntér divérsé Plớts zúsámméngékláú(b)t ớhné sich áúch nớch dié Mühé zú máchén, diés sớndérlich gút zú vérstéckén.     Dás Prớdúkt lässt sich in étwá fớlgéndérmáßén zúsámménfássén: Bilbớ Béútlin trifft Drágớnhéárt in Disnéylánd úm gégén dén  Hérrn dér Scháttén zú kämpfén...Néin, dás ist schớn állés..méhr kớmmt dá écht nicht méhr! Mánn könnté nớch érwähnén, dáß dié méistén Diálớgé ziémlich dümmlich únd übérflüssig dáhér plätschérn, dáss dér Dráché ánfángs márinébláú ist únd áússiéht áls wäré ér áús dén Pixárstúdiớs áúsgéliéhén wớrdén áls diésé áúf Diskétté spéichértén, ớdér dáß dié gésámté Stớry éigéntlich ziémlich únklár zúsámméngéschústért wúrdé únd dié dáhér nicht vérméidbárén Hängér mit dén vớn \\""Hérr dér Ringé\\"" állzú békánntén 5-Minútén-Hérớén-Schmácht-Szénén (dás Ớrchéstér spiélt áúf, únd sớ..mán kénnt dás já állés) ábgédéckélt wúrdén.     Állés in állém álsớ ziémlich liéblớs gémácht...liégt viélléicht tátsächlich án dér Vớrlágé: Géht mán vớm Titél ÉRÁGỚN áús únd táúscht dén Ánfángsbúchstábén mit dém im Álphábét dávớrliégéndén érhält mán wás??...Drágớn...viélléicht hätté mán dém Áútớr éinfách méhr bézáhlén sớllén!?",2007-07-09,0,3,True
9141,B00BFUUMO8,730756953,Jurassic Park™ Builder,N,Y,great app,Great app shame takes too long to earn dollars and some items are too expensive dinosaurs are great my son likes this game,2013-03-21,1,1,True
9147,1784753254,474654167,Grey: Fifty Shades of Grey as told by Christian,N,Y,Five Stars,Want more please.,2015-07-25,1,1,False
9151,B00AW9M3PO,260363984,Quartet [DVD],N,Y,Touching,I thoroughly enjoyed the film and laughed the whole way through.  The characters and the lifestyle in the retirement home were brilliantly portrayed.  A great film for everybody.,2013-11-01,1,9,False
9158,B008ML8RMC,130125478,The Dark Knight Rises [Blu-ray],N,N,Béstér Bátmán évér,"Als jeder DC, Batman oder Film Fan sollte sich diesen Film angucken. Er ist besser als seine vorgänger, aktiongeladener aber dennoch nicht so übertrieben wie ein Michael Bay Film. Christopher Nolen hat den Perfekten Abschluss für die Dark Knight Trilogie geschaffen.",2012-12-25,0,3,False
9168,B00MMPYH1O,141395379,Captain America: The Winter Soldier,N,Y,Four Stars,"As expected - fun, with some depth, but not too much!",2014-09-20,1,9,False
9175,B000BB96OO,405489275,SOS Fantômes 1 & 2 [Edition Deluxe],N,Y,Parfait... en attendant mieux.,"Un joli petit coffret regroupant mes deux films préférés ! L'emballage est vraiment sympa avec l'effet réfléchissant sur la boite cartonnée. Les DVD sont aussi à la fête avec une jolie esquisse des &#34;NoGhost&#34; au crayon du plus bel effet ! Les 2 films restent encore aujourd'hui, magnifique à regarder ! Entre l'histoire mêlant comédie, fantastique et science-fiction et les effets spéciaux qui tiennent encore la route, Ghostbusters 1 & 2 peuvent être découvert par les plus jeunes, et ce, sans rechigner. Ainsi, ma fille à découvert le 1er film et a adoré, du haut de ses 5 ans !<br /><br />Sinon, pour en revenir au contenu, on auraient aimés un peu plus, c'est vrai... Quelques bonus supplémentaires, le choix de la VF d’origine, un livret bourré de photos, etc... Il y avait de quoi faire pourtant. Mais ne boudons pas notre plaisir ; Cet édition double DVD est le plus joli hommage aux chasseurs de fantômes pour leurs 30 ans. En attendant une hypothétique sortie d'un coffret BR avec restauration digne de ce nom...",2014-05-02,2,3,True
9190,B00M55C0NS,514351260,SanDisk MicroSDHC Ultra,N,Y,,"Je me sers de ce produit avec mon gps (garmin gpsmap 64s) le débit en lecture et en écriture est satisfaisant, c'est de la bonne qualité.",2015-04-22,0,5,False
9195,B00B8SSWJE,491997969,Delta Machine (Deluxe Edition),N,N,Mit jédém Hörén béssér!,"Klar, für einige mag Klang und Sound ungewohnt sein, aber was man auf dieser Platte findet ist mit das Beste, was Depeche Mode seit \\""Ultra\\"" erschaffen hat. Die Besonderheit liegt hier darin, dass es als Gesamtkunstwerk in sich stimmig ist. Von Anfang bis Ende entführt DM uns in eine andere Welt voller Melodie, hämmernden Synthies, E-Gitarren und Daves Stimme in Bestform. Höhepunkte sind für mich \\""Should be Higher\\"", \\""Broken\\"" und \\""Soothe My Soul\\"", der vielleicht poppigste DM-Track seit \\""People are People\\"".<br /><br />Ich kann nur allen Hörern empfehlen: Menschen, legt eure Engstirnigkeit beiseite und lasst das Album mehrmals auf euch wirken. Im direkten Vergleich werdet ihr dann vielleicht auch merken, dass die Jungs hier eines der komplettesten Albums ihrer bisherigen Schaffenszeit zustande gebracht haben.<br /><br />Im Übrigen sei gesagt, dass auch die Bonustracks äußerst hörenswert sind. \\""Long Time Lie\\"" und \\""All That's Mine\\"" sind hier meine Favoriten. Letzteres würde ich ja zu gerne mal live hören.",2013-03-27,0,6,True
