,product_id,product_parent,product_title,vine,verified_purchase,review_headline,review_body,review_date,marketplace_id,product_category_id,label
6317,B003VQVK86,934871546,Leonard Cohen - Live In London/Visual Milestones,N,Y,Ein Meister seiner Zeit,"Viel gibt es nicht mehr zu Leonard Cohen zu sagen. Viele vorherige Rezensionen sprechen mir aus der Seele. Daher von mir ein ausgezeichnet und volle 5 Sterne (leider gibt es keine sechs).<br />Die Qualität des gezeigten Videos ist ausgesprochen gut und hat mich überzeugt, ebenso der Ton. Cohen hören ist fast zu wenig, man muss ihn dabei auch sehen ... und geniesen.  Ich bin begeistert.",2013-09-21,0,11,False
6322,B007Z8ZKS2,582629146,The Fault in Our Stars,N,Y,Yes,I read and listenned to this book during the weekend. I couldn't put it down.<br />I would recommend it.,2015-08-19,1,4,False
6345,B0014T7ETQ,726551932,quelle déception!!,N,Y,Lost In Austen [Import anglais],"Une version beaucoup trop alambiquée et pas du tout prenante... L'actrice principale est ridicule, les autres aussi d'ailleurs... Nous avons toutes rêvé de vivre cette aventure, mais l'ensemble tombe complètement à plat. Quand on adore O et P, on peut se passer de cette version, il y a tellement mieux par ailleurs!!",2012-12-23,0,3,True
6350,B000B83Z4O,451129557,V for Vendetta [DVD] [2006],N,Y,Watching this is ThoughtCrime!,"The \\""official\\"" reviews of this movie will all try and put you off seeing this.  They'll tell you it's too intellectual, too clunky, not \\""fluffy\\"" enough, the \\""wrong type\\"" of adaptation of an 80's comic book.    They're wrong.  Check out the viewers' reviews - people think this movie is great.  Finally, a film that bravely and honestly addresses the gradual drift of our society to a heavily-manipulated and brainwashed police state.  Yes, it's a political movie, very much so.  But it also refuses to patronise the audience - rather than thinking people are dumb, as Hollywood often seems to, this movie thinks that people can think for themselves, and see through the \\""dumbing down\\"" which the media foist upon us.    The cast of this movie all know they're making an important statement.  Stephen Fry, John Hurt, Stephen Rea all do excellent and believable jobs supporting Hugo Weaver and Natalie Portman.  It's like a recipe for how to bring down a government - a \\""How To\\"" manual of civil disobedience and resistance, and a refusal to swallow the propaganda that demands that we all live in fear and give up our freedoms for a \\""little more security\\"".  As such it's a deeply subversive film.    Cracking movie - cool music, stylised visuals, great action scenes, and a message that even when \\""They\\"" tell us we're helpless, we're not!  Power to the People - don't let \\""Them\\"" stop you watching this film!",2007-12-05,1,3,True
6368,B0043XYXLM,313509963,Resident Evil: Afterlife 3D (Premium Edition) [Blu-ray 3D],N,Y,Sehr guter film mit hochwertigen 3D Effekten,Leider Kompatibilitätsprobleme mit LG Player welches erst nach wochenlangen Warten mittels Update behoben werden konnte. Das ist leider traurige Realität für Besitzer legaler Filme.,2013-01-25,0,3,False
6373,0751529818,725864791,"Tuesdays With Morrie: An old man, a young man, and life's greatest lesson",N,N,beautiful book full of wisdom - without love we perish ...,beautiful book full of wisdom - without love we perish reminded me of the quote<br />'only the unloved and unnatural hate',2015-07-25,1,0,False
6381,B003WO7HAC,22701133,Jane Austen's Pride & Prejudice (15th Anniversary Edition) [6 DVDs] [Collector's Edition],N,Y,Diesen Film kann ich mir 10 mal ansehen und ich schmelze immer noch,"Ein wundervoller Film, voller Spannung und Spannungen und sooooo romantisch. Ich finde es super, dass Jane Austen's Romane verfilmt werden, denn ich lese nicht gerne. Ich hatte schon den 2005 Pride & Prejudice Film und es ist wundervoll beide Versionen anzuschauen. Beide mit einer super Rollenbesetzung und hier noch die extended edition ist einfach noch ein schönes Tüpfelchen auf dem i. Sehr empfehlenswert!",2013-01-17,0,3,False
6382,B00FG090S2,126004443,Gravity [Blu-ray],N,Y,Géniálér SciFi Thrilér,"Im Orbit ist die Hölle los, und ein Desaster jagt das nächste. Wie man im Weltraum gefühlt ein halbes Dutzend absolut tödlicher Situationen übersteht, macht Sandra Bullock in Gravity vor. Dabei überzeugt der Film vor allem durch seine spektakuläre Optik, die rein technisch gesehen, für zukünftige SciFi Produktionen die Messlatte sehr hoch legt. Dass die Story dabei auf einem Bierdeckel Platz finden würde und sich etliche Logiklöcher und physikalische Fehlleistungen einschleichen, stört nur dann, wenn man Zeit findet, bei dieser rauschhaften Weltraumtour die Dinge zu hinterfragen. Und das erweist sich bei diesem temporeichen visuellen Meisterstück nicht gerade als leicht. Absolut Empfehlenswert",2014-03-21,0,3,True
6383,0141187816,958015468,The Beautiful and Damned (Penguin Modern Classics),N,N,VERY TOUCHING AND VERY WELL DONE,"\\""It is seven thirty on an August evening. The windows in the living room of the gray house are wide open patiently exchanging the tainted inner atmosphere of liquor and smoke for the fresh drowsiness of the late hot dusk. There are dying flower scents upon the air, so thin, so fragile, as to hint already of a summer laid away in time.\\""<br /><br />This is the story of a young couple Anthony and Gloria Patch living out their days to the hilt in New York City as they await the death of Anthony's grandfather, Adam Patch from whom they expect to inherit his massive fortune.<br /><br />Gloria is a spoilt child from Kansas City turned into a sophisticated and most beautiful woman. Gloria does not intend to lift a finger to do any domestic work in the home, no matter how slight; while Anthony who considers himself an aesthete, finds it quite hard to get his act together and instead of buckling down to some work, prefers instead to hang with his wife and their friends on nightly binges. They drink and eat in the classiest restaurants and hotels, rent the most expensive apartments, travel out to the West in the spring time driving plush cars, wearing top-of-the-line clothing and just generally living it up high on the hog, as they wait.<br /><br />Meet Maury Noble who is Anthony best friend who spends his time between New York and Philadelphia; Richard Caramel who has just completed writing a book and looking for new ideas for a second one. Joseph Bloeckman from Munich who started out small in America and is now a big shot in Show Biz. Also the quiet Jewess Rachael Barnes and Muriel Kane who is young, flirtatious and sometimes a bit too talkative and Tana the Japanese housekeeper of the Patches.<br /><br />We are shown the Patches at their very best as the novel starts, with the world at their feet and loaded with cash with which they make very expensive choices. But, as we get further in, we see things begin to change gradually and we realize that those very choices will be their very downfall. It was quite a good read but it could be very heartbreaking at times as we put ourselves into the shoes of the main characters. All lovers of F. Scott Fitzgerald should read this book if you haven't done so already, and those of you who like reading about the ultra rich in the Roaring Twenties this one is for you. It is the kind of book that you feel you will want to read again. It is that good and I shall miss it.<br />Reviewed by Heather Marshall Negahdar (SUGAR-CANE 29/06/09)quite a good read but it could be very heartbreaking at times as we put ourselves into the shoes of the main characters. All lovers of F. Scott Fitzgerald should read this book if you haven't done so already, and those of you who like reading about the ultra rich in the Roaring Twenties this one is for you. It is the kind of book that you feel you will want to read again. It is that good and I shall miss it.   Reviewed by Heather Marshall Negahdar (SUGAR-CANE 29/06/09)",2009-06-30,1,0,True
6411,B0000541B2,342373115,Official Sony PlayStation 2 DualShock 2 Controller,N,N,GR8,"This is a fantastic item to go with your PS2 its cheap and fun. Great for christmas works fine had no problems at all. I would buy the wireless pad though, with the wireless pad you can go upstairs an it would still work. But this is fantastic and I strongly recommend that you buy this for christmas or any other time such as Eid.",2009-12-07,1,20,False
6412,B00CE26AU6,645105181,Le Nozze di Figaro,N,N,Zum Träumen schön,"Was für eine wunderschöne Aufnahme; hier hat ein hervorragend ausgewogenes Ensemble unter einem Dirigenten, der in Sachen Interpretation und gewählter Tempi allen arrivierten Kollegen ein Schnippchen schlägt, den tollen Tag wirklich mal \\""ernst\\"" und beim Wort genommen. Herrlich die Einzelinterpretationen der Charaktere: der anfangs noch recht testosterongesteuerte Graf von Andrei Bondarenko (man höre nur die erste Szene zwischen ihm und Susanna!), die nicht so lyrisch süße, dafür aber pragmatisch-witzig auftrumpfende Fanie Antonelou als Susanna. Simone Kermes singt sich mit sinnierend fast körperlosem Ton schon mit dem Porgi amor in eine ganz eigene Liga. Dazu der androgyne Mezzo Mary-Ellen Nesis' Cherubino, Christian van Horn mit ausgeglichenem Bariton als wirklich guter Figaro - da stimmt einfach alles. Auch die musikalische Seite kommentiert das versiert und unter der frischen Leitung Teodor Currentzis frech aufspielende Ensemble Musicaeterna. Das ist nach Jahrzehnten wohl endlich die Referenzaufnahme des Werks, die sehr lange eine Spitzenposition halten dürfte. Bravo!",2014-02-28,0,6,True
6459,B00AAQRNQ8,807565333,"Anker® Souris Gamer, capteur laser de haute précision(8200 DPI), filaire (1.8m), 9 boutons programmables, cartouche de personnalisation du poids, micro-commutateurs Omron.",N,Y,,"Que dire si ce n'est que ce mulot des villes est juste génial et ultra précis. Que le vendeur a été rapide et a très bien conditionné l'article?<br />Si ceci fait partie de vos besoins, alors allez-y sans retenue. Transaction parfaite !",2013-10-11,2,23,False
6469,B0063DOL8K,869240580,Courageous - Ein mutiger Weg,N,Y,One of the best movies ever!!!,"Dieser Film hat alles, was eine gute Story ausmacht. Spannung, Familie, Freundschaft, Liebe, Hass...<br />Super schön und vor allem von sehr guter Moral. Man schaut den Film und denkt hinterher, dass man die Zeit sinvoll genutzt hat.",2013-04-09,0,3,False
6472,B009VI683A,273239820,White House Down [DVD] [2013],N,Y,Five Stars,Thanku,2015-03-23,1,3,False
6482,B000K14LTA,16203310,Kingdom Of Heaven (Director's Cut) [Blu-ray],N,Y,Great Blu ray,This package came on time I got it for my dad for his birthday he loved the flim and would recommend it to anyone,2013-06-28,1,3,False
6508,B00BU6MU8I,896875719,Star Trek 06 - Das unentdeckte Land [Blu-ray],N,Y,Das grandiose Ende einer großen Weltraum-OPERA,"Grándiớsé Filmé im Sinné éinér Spácé-Ớpérá sind dié STÁR TRÉK FILMÉ 1-6, trớtz schwächélndém 5.Téil; mán múss sié zúsámmén béwértén & séhén, génáúsớ wié INDIÁNÁ JỚNÉS 1-3, KRIÉG DÉR STÉRNÉ únd DÉR PÁTÉ 1-3.<br /><br />Áúch nách übér 30 Jáhrén wirkén dié Filmé - héúér digitál géschärft in BlúRáy - nớch übérzéúgénd únd sind práchtvớllé éwig schöné Kinớúntérháltúng, dánk sympáthischér wúndérbárér Prớtágớnistén, grớßártigér Músik, éiném gútén Dréhbúch únd ákzéptáblén Diálớgén.<br /><br />Állés Dingé, dié úns héúté - wớ mán gláúbt mit júgéndlichén nichtsságéndén Állérwélts-Discớ-Gésichtérn únd géhirnámpútiértén Diálớgén áúf RTL-Lớbớtớmistén-Nivéáú könnté mán grớßés Kinớ máchén - léidér ábhándén gékớmmén sind.<br /><br />Dás ist úntérháltsámés Kinớ áltén Schlágés, mán sinkt in éiné phántástisché Tráúmwélt. Ich hớffé dớch séhr, dáß ich diésé gútén Filmé nớch mit méinén Énkéln ánscháúén in spätérén kánn, dámit sié lérnén wás éinst gútés Kinớ wár. Film áls Kúnstwérk!<br /><br />Múß mán ábér áúf grớßér héimstúdiớn léinwánd séhén - zú kléin áúch für Größé Fláchbildschirmé.",2014-04-05,0,3,True
6516,B000002GJ7,905502182,Pornograffitti [Import USA],N,N,,"\\""Pornograffitti\\"" est tout simplement un des derniers grands albums de hard-rock publié en 1990 avant le déferlement de la vague grunge des Nirvana and co en 1991. l'exceptionnelle qualité de cet album et son très grand succès commercial n'ont pas pu empecher la vague grunge qui s'annonçait déjà depuis l'accession au sommet dès 1987 de GUNS N ROSES et la vacuité totale des groupes de glam-rock comme Poison qui ont fini par ecoeurer le public.",2007-06-03,0,6,True
6527,B008GRN43O,621625599,,N,Y,Le Lorax,Produit bien protégé. Conforme petites filles contentes pour les vacances à regarder avec la neige qui tombe dans le jardin,2013-02-25,2,3,False
6538,B00544XKK4,480698551,"Logitech Z120 Notebook-Lautsprecher 2.0 (mit 3,5 mm USB-Stromversorgung) schwarz/silver",N,Y,Für Notebook gut geeignet.,Schelle Lieferung. Der Klang ist für meine &#34;Ansprüche&#34; voll ausreichend. Ich habe die Geräte an mein Notebook angeschlossen. Es funktioniert auch einwandfrei am Smartphone.,2014-10-22,0,5,False
6541,B004ZN9W5M,518868881,The Wall (Discovery Edition),N,Y,ce n'est pas la version originale!,Je n'ai pas bien lu l'annonce et n'ai pas remarqué qu'il s'agissait d'une version remastérisée... plus proche de la Dance Music que du Pop Rock....<br />Evitez cet achat si vous êtes fan du &#34;son&#34; Pink Floyd,2015-01-29,2,6,True
6542,B001J06KPY,676751947,The Illusionist - Kaufversion im veredelten Stülper,N,N,Vérfémtés Méistérwérk!,"Dieser Film stand 2006 völlig zu Unrecht im Schatten von &#34;Prestige&#34; und kam bei uns noch nicht einmal in die Kinos. Ich durfte den Film dank Qatar Airways auf einem Flug nach Asien schauen und war sofort gefesselt. Neil Burger bietet Magie, Rivalität, große Gefühle, Liebe und letztlich einen der besten Endtwists, die ich jemals gesehen habe. Dazu kommen bestens aufgelegte Schauspieler und eine geniale Optik. Nicht ohne Grund wurde Kameramann Dick Pope 2007 für den Oscar nominiert. Dieser Film ist romantisch, mordsspannend und macht zudem auch noch unheimlich Spaß. Einer meiner absoluten Lieblingsfilme.",2015-05-26,0,11,False
6565,B003YV64OI,718239497,"AMD ADX450WFGMBOX CPU AMD AM3 Athlon II X3 450 Box (3x 3,2 GHz)",N,Y,Prozessor,"Endlich läuft mein ASRock N68C-S UCC Mainboard Sockel (AMD, AM2, AM2+, AM3, nF630, DDR2, DDR3, Micro ATX) mit DDR 3 Rams,",2012-08-18,0,5,True
6573,B0018TLRTU,813891884,"Best of-Idolize Yourself,Very + DVD",N,N,Billy inklúsivé Bánd sind éinfách grớßártig - Nớtfálls áúch mit éinér wéitérén Bést ớf...,"Ich muss an dieser Stelle mal meinen Frust über die Sternvergabe der ersten Rezensionen zum Ausdruck bringen. Liebe Idol-Fans, wenn ihr es denn seid, laßt die meines Erachtens ungerechtfertigte Abstraferei für Billy Idol, wenn diese sich vermutlich eher gegen sein neues (oder eigentlich altes) Label Chrysalis richten sollte. Billy hat sich inkl. Band deutlichst für eine Veröffentlichung eines !neuen Albums ! ausgesprochen, nur sitzen da andere am längeren Hebel. Der Einzige, dem jedoch mit dieser grandiosen Punkteverteilung geschadet wird ist Billy selbst. Ob dies im Sinne eines Fans ist, sei mal dahingestellt. Auch wenn ich mich persönlich ebenso wenig über eine weitere Best Of freue, bei der zu allem Überfuss auf der DVD auch noch alle Videos enthalten sind, die man eh schon alle hat, ist es für mich dennoch ein Highlight Billy wieder bei einem großen Label unter Vertrag zu wissen. Billy und seine Jungs sind allesamt großartige Musiker, die eine ordentliche Chance verdient haben und diese sollte mit Chrysalis im Rücken sogar vielversprechend werden können. Das Label wird sicherlich neben den Abverkaufszahlen auch Reaktionen auf das Album beobachten, dass da eine schlechte Punktzahl des Albums förderlich für Billys Zukunft wäre, wage ich zu bezweifeln.    Billy rockt! .... und seine Songs sind nicht plötzlich schlechter geworden, nur weil ein Label in der heutigen Zeit 'die Hosen voll hat' und die vermeintlich sichere Schiene fahren will, indem erst einmal die X-te Best Of zusammengezimmert wird. Immerhin sehen die wohl immer noch Potential in 'the lip' und warten nun auf Reaktionen der Fans. Bleibt für Billy Idol zu hoffen, dass es neben den Nörglern noch unzählige gibt, die ihn lieber stützen wollen, damit das langersehnte neue Album dann auch kräftig beworben werden kann, damit es dann wie eine Bombe einschlägt. Ich gönn's den Kerlen von A bis Z und an alle, die tatsächlich noch keine BO von Billy haben: KAUFEN!!",2008-06-09,0,6,True
6574,2253006734,39495389,Le seul livre qui m'envoute encore des ann&eacute;es apr&egrave;s !,N,Y,Rebecca,"J'adore l'univers onirique, quasi-fantastique, l'ambiance gothique du roman. Je n'ai pas aim&eacute; le film car pour moi, R&eacute;b&eacute;cca est vivante dans toute l'histoire. J'adore l'histoire qui parle d'une Absence de communication dans le couple. L'une est jeune, immature, sauv&eacute;e d'une certaine mani&egrave;re de sa situation par un homme plus age. Lui est incapable d'exprimer ses sentiments d'amour &agrave; l'encontre de la jeune femme, pertub&eacute; par sa pr&eacute;c&eacute;dente relation avec R&eacute;b&eacute;cca. On n'a que le point de vue de la jeune femme qui pense qu'il lui pr&eacute;f&egrave;re son ex-femme. Elle parle de cette rivale dont elle tente d&eacute;sesp&eacute;r&eacute;ment d'etre &agrave; la hauteur, trop belle, trop intelligente avant de d&eacute;couvrir la v&eacute;rit&eacute; : ce qu'elle poss&egrave;de que l'autre ne poss&egrave;de pas l'amour, la bont&eacute; de l'âme. C'est un roman &agrave; suspens avec une v&eacute;ritable intrigue polici&egrave;re. L'histoire du passage d'une jeune adolescente, avec une image fragilisee d'elle-meme qui devient femme, en lutte avec R&eacute;b&eacute;cca ou au fond, ses propres d&eacute;mons, mat&eacute;rialis&eacute; par R&eacute;b&eacute;cca. L'histoire d'amour est belle : l'histoire d'un couple qui se rapproche, se d&eacute;couvre au moment ou le probl&egrave;me surgit. J'adore le style et l'histoire.",2013-06-19,2,0,True
6586,B00B3SH7H2,490520805,L'Homme aux poings de fer [Version Longue],N,N,"Avant Tarantino, il y a le film de genre...","\\""L'homme aux poings de fer\\"" est un film d'action du rappeur RZA rendant hommage aux grands films de la Shaw Brothers mais plus largement aux nombreuses oeuvres d'exploitation chinoises comme le film de kung-fu et le wu xia pian, jouant parfois sur les codes du chambara, du western et même du manga. Si le film possède deux facettes dont la première sera vite résumée par un bon film pop-corn divertissant et propice à la détente, il serait fâcheux de laisser de côté la seconde, vibrant hommage de RZA, cinéphile endurci, multipliant les références à de nombreux classique. On citera par exemple \\""[[ASIN:B0010XRC9S La Main De Fer]]\\"" évidemment, \\""[[ASIN:B001IDPPV2 Histoires de fantomes chinois]]\\"", \\""[[ASIN:B0009NZYCC Les 8 diagrammes de Wu-Tang]]\\"", \\""[[ASIN:B00005QZUB The Killer]]\\"", \\""[[ASIN:B00006LAA7 Tai-Chi Master]]\\"", \\""[[ASIN:B000E0VX7K 5 venins mortels]]\\"", la trilogie \\""[[ASIN:B007K8FS16 Le Sabreur manchot]]\\"" j'en passe et des meilleurs. Les amateurs auront tôt fait de comparer ce film aux \\""[[ASIN:B002KMW8DS Kill Bill]]\\"" de Tarantino dont ils n'auront sans doute pas compris l'essentiel de la substance, faute d'avoir vu ne serait-ce qu'un dixième des films auxquels ils font référence. Au même titre que Tarantino, RZA réalise un film de cinéphile avant d'être un film de cinéaste. La comparaison s'arrête là mais force est de constater que cela fonctionne du tonnerre. A condition d'avoir un peu de culture cinématographique... Techniquement, l'image est belle, les effets spéciaux propres, les scènes d'action très agréables, le montage fluide et on s'amuse à voir de nouveau la bonne vieille utilisation des cables comme dans les films chinois d'époque. Grosse production probablement tournée en chine, les décors sont vraiment magnifiques ainsi que les costumes. Niveau casting, Russel Crowe surjoue tellement son personnage qu'il en devient jouissif, Batista joue parfaitement l'endive stéroïdée et Rick Yune rempli bien son contrat. Du côté desacteurs chinois on sera ravi de revoir Daniel Wu, Lucy Liu et surtout Gordon Liu, excellent acteur ayant beaucoup joué dans les films de Liu-Chia Liang (son frère adoptif). Seul bémol du côté de RZA campant le rôle principal. S'il n'est pas désagréable, son jeu reste relativement plat. Du côté du scénario, rien de très profond mais on reste dans la veine de bien des films de la Shaw Brothers dont les codes sont parfaitement respecté (trahison, vengeance, amitié virile, les filles servent de caution hétéro mais les garçons finissent toujours ensemble). La bande originale quand à elle sert parfaitement les scènes mélangeant le rap de RZA, quelques riffs de guitare et musique traditionnelle chinoise donnant au film un côté à la fois pop et authentique. En résumé, un excellent moment passé sur \\""L'homme aux poings de fer\\"" ou l'on ressent bien le plaisir qu'à pris RZA à le réaliser. On en viendrait presque à en redemander !<br /><br />Du côté support, le blu-ray remplit son office tant sur le plan visuel qu'auditif (DTS pour la VF et DTS HD pour la VO) sans être non plus flamboyant (contrairement à la direction artistique qui l'est vraiment). On regrettera cette édition chiche en bonus mais toutefois appréciée pour la présence de la version cinéma et de la version longue non-censuré rajoutant environ 8 minutes et que je vous conseille en premier visionnage.<br /><br />Un excellent achat remplissant son office en somme.",2013-09-08,2,3,True
6596,B00544XKK4,480698551,Logitech Z120 Laptop Speakers 3.5mm USB,N,Y,Great value - great sound,"I am really pleased with these budget speakers. They are a great sound (for the price) and look really nice too.<br /><br />As expected, easy to plug in and work 'out of the box'<br /><br />Very happy.",2013-12-11,1,5,False
6604,B00AREIAI8,265040255,My Horse,N,Y,sch&ouml;n f&uuml;r Pferdebegeisterte,"Meine Tochter liebt das Spiel und st&ouml;rt sich noch (!) nicht daran, dass man ohne Zusatzk&auml;ufe immer einige Wartezeit (2min bis etliche Stunden) hinnehmen muss. So wird das Spiel wenigstens auch mal weg gelegt.",2014-03-05,0,1,False
6614,B008HTQ28K,273127372,The Racketeer,N,Y,A Gripping Grisham!,"Haven't read any Grisham for a bit as I thought he'd gone off the boil, but I really enjoyed this. It starts slowly, and I wondered if it was going to be a bit pedantic, then the incredibly complicated plot got going and I was hooked. Yes, I did see the twist quite a bit before I got there, but I had to keep reading to be sure my Sherlock-Holmes-like deductions were correct! This felt like, if not vintage Grisham, not far off. And a great deal better than most of his would-be imitators.",2013-10-07,1,4,False
6625,B0087OYKM0,320061877,"E.T., l'Extra-Terrestre [Combo Blu-ray + DVD - Édition Limitée boîtier SteelBook]",N,N,MAISON.......,Fabuleux  ! c'est l'effet que j'ai eu en regardant le film le son l'image parfaite pour un film de cette age ! petit prix mais grande qualité et puis film culte.,2014-01-20,2,1,False
6629,0224098098,16141818,Bridget Jones: Mad About the Boy (Bridget Jones's Diary),N,Y,disappointing,"This was so thin and badly written, maybe I had romanticised the last books thanks to the entertaining movie, but I have to say, I popped it in the bin about 1/3rd through. Life really is too short for this rubbish",2013-11-29,0,0,True
6656,B00006L99L,656381957,Le Voyage de Chihiro,N,Y,Magnifique conte initiatique,"Ce film a été un véritable cadeau, et ne cesse de l'être à chaque fois que je me replonge dedans (en le regardant, ou simplement en y pensant).  Quelle merveille, à tout point de vue : l'histoire, la qualité des dessins et de l'animation qui nous fait totalement oublier que l'on regarde un film d'animation, la créativité, et le sens profond de ce conte initiatique. Tout est parfait, pas une seconde à retirer de ces 2h de pur bonheur. Dès le début on est pris dans l'histoire et ce voyage, nous le faisons avec Chihiro, nous passons comme elle par toute une palette d'émotions, on est portés, emportés, on n'a pas d'autre choix que de se laisser aller comme poussés en avant vers l'inconnu, l'émerveillement...   Et quelle sagesse, quel enseignement Hayao Miyazaki nous délivre...     Chihiro nous montre la voie, à chaque instant, de la tolérance, de l'ouverture, de l'authenticité, de l'amour, de l'humilité (elle n'a pas peur de montrer qu'elle a peur), du don de soi, du pardon, de la générosité, du courage, de la persévérance, du lâcher-prise, de la confiance, de la témérité, et j'en passe...    Ne passez pas à côté de ce petit bijou.",2008-09-25,0,3,True
6681,B003IJLTQ4,165995375,Super Sache für 45cent,N,Y,Exile On Main Street (Deluxe Edition),Amazon hatte diesen Artikel falsch gelistet und und hat ihn für 45 Eurocent angeboten. Für 45 Eurocent kann man bei den Stones nix falsch machen.,2012-11-09,0,12,False
6684,B00QEGDI30,770497487,"The Fast Diet: Revised and Updated: Lose Weight, Stay Healthy, Live Longer",N,Y,Five Stars,"Excellent, easy to understand, easy to follow - and it works!",2015-03-04,1,4,False
